"Url","Source","Title","Published"
"http://en.ria.ru/world/20140515/189841194/US-Health-Authorities-Call-for-Wider-AIDS-Prevention-Drug-Use.html","RIA","US Health Authorities Call for Wider AIDS-Prevention Drug Use","2014-05-15T10:29:00.0"
"http://en.ria.ru/world/20140515/189840221/European-Partners-Protect-Gazprom-CEO-Miller-from-EU-Sanctions--.html","RIA","European Partners Protect Gazprom CEO Miller from EU Sanctions - Media","2014-05-15T09:17:59.0"
"http://en.ria.ru/world/20140515/189840046/One-Dead-Four-Hurt-in-Kramatorsk-Shootout-in-Ukraine.html","RIA","One Dead, Four Hurt in Kramatorsk Shootout in Ukraine","2014-05-15T09:14:00.0"
"http://en.ria.ru/world/20140515/189839311/Ukraines-Kharkiv-Self-Determination-Referendum-Still-At-Issue-.html","RIA","Ukraine’s Kharkiv Self-Determination Referendum Still At Issue – Activist","2014-05-15T08:54:53.0"
"http://en.ria.ru/world/20140515/189839140/Kazakhstan-Ratifies-Joint-Air-Defense-Shield-Deal-with-Russia.html","RIA","Kazakhstan Ratifies Joint Air Defense Shield Deal with Russia","2014-05-15T08:50:09.0"
"http://en.itar-tass.com/world/731733?utm_medium=rss20","TASS","Response to Ukraine’s use of UN symbols near Ukraine’s Kramatorsk matter of UN secretariat","2014-05-15T12:09:00.0"
"http://en.itar-tass.com/world/731730?utm_medium=rss20","TASS","Decision on NATO military bases deployment in Eastern Europe may be adopted in September","2014-05-15T11:57:05.0"
"http://en.itar-tass.com/world/731724?utm_medium=rss20","TASS","UK refuses to attend Energy Forum in Moscow due to situation in Ukraine","2014-05-15T10:59:57.0"
"http://en.itar-tass.com/russia/731710?utm_medium=rss20","TASS","Russia-Ukraine military cooperation volume stands at $10 million, may fall soon","2014-05-15T09:44:03.0"
"http://en.itar-tass.com/world/731709?utm_medium=rss20","TASS","Russia to deliver 30 choppers for Afghanistan army under contract with US","2014-05-15T09:28:55.0"
"http://en.itar-tass.com/world/731704?utm_medium=rss20","TASS","White House denies reports about US mercenaries in Ukraine","2014-05-15T08:49:22.0"
"http://en.itar-tass.com/world/731706?utm_medium=rss20","TASS","US not to provide military assisstance to Nigeria in search for kidnapped schoolchildren","2014-05-15T08:38:52.0"
"http://en.itar-tass.com/world/731682?utm_medium=rss20","TASS","Ukrainian presidential candidate Poroshenko claims Kiev will mend ties with Moscow fast","2014-05-15T06:23:39.0"
"http://en.ria.ru/world/20140515/189845173/Michelle-Obamas-Twitter-Campaign-for-Missing-Nigerian-Girls.html","RIA","Michelle Obama’s Twitter Campaign for Missing Nigerian Girls Backfires","2014-05-15T12:59:00.0"
"http://en.ria.ru/russia/20140515/189845053/Moscow-Says-Ukraine-Unable-to-Pay-for-Gas-Supplies.html","RIA","Moscow Says Ukraine Unable to Pay for Gas Supplies","2014-05-15T12:57:00.0"
"http://en.ria.ru/world/20140515/189844305/EU-Third-Energy-Package-Creates-Investment-Risks.html","RIA","EU Third Energy Package Creates Investment Risks","2014-05-15T12:35:00.0"
"http://en.itar-tass.com/economy/731731?utm_medium=rss20","TASS","Ukraine unable to pay for gas supplies even with discount — energy minister","2014-05-15T12:41:38.0"
"http://rt.com/politics/official-word/159228-putin-ukraine-eu-gas/","RT","Vladimir Putin’s declaration to foreign leaders on Ukrainian gas crisis","2014-05-15T18:00:59.0"
"http://rt.com/op-edge/159208-us-involvement-trouble-ukraine-nsa/","RT","Ron Paul: ‘US involvement into affairs of other states leads only to trouble’","2014-05-15T16:32:09.0"
"http://rt.com/op-edge/159192-china-opposes-to-sanctions-russia/","RT","China ‘opposed to sanctions of any kind’ over Ukraine","2014-05-15T15:45:44.0"
"http://rt.com/business/159200-ukraine-gas-russia-payment/","RT","Russia to deliver gas to Ukraine only on prepayment - Putin","2014-05-15T15:18:11.0"
"http://rt.com/business/159128-russia-ukraine-gas-price/","RT","Russia ‘open’ to gas price negotiations with Ukraine, if they start to repay debt","2014-05-15T13:00:52.0"
"http://rt.com/news/159068-syria-rebels-dempsey-us/","RT","US says it will increase aid to Syrian rebels","2014-05-15T13:00:15.0"
"http://edition.cnn.com/2014/05/15/us/september-11-museum-ceremony/index.html?eref=edition","CNN","New York dedicates 9/11 museum","2014-05-15T16:24:39.0"
"http://edition.cnn.com/2014/05/15/politics/boko-haram-state-department/index.html?eref=edition","CNN","Resolving crisis a U.S. priority","2014-05-15T18:42:17.0"
"http://feeds.reuters.com/~r/Reuters/worldNews/~3/2tuhnClrxIc/story01.htm","REUTERS","U.S. criticizes Nigeria over kidnapping response","2014-05-15T15:50:46.0"
"http://en.ria.ru/world/20140515/189851144/OPINION-European-Days-of-Action-Should-Spread-to-Russia-Ukraine-.html","RIA","OPINION: 'European Days of Action' Should Spread to Russia, Ukraine – Activist","2014-05-15T16:52:00.0"
"http://en.ria.ru/world/20140515/189851065/West-Never-Invited-Russia-to-Join-NATO--Report.html","RIA","West Never Invited Russia to Join NATO – Report","2014-05-15T16:47:00.0"
"http://en.ria.ru/world/20140515/189849964/West-to-Seek-Focused-Reciprocal-Cooperation-with-Russia--NATO.html","RIA","West to Seek Focused, Reciprocal Cooperation with Russia – NATO Research","2014-05-15T16:19:00.0"
"http://en.ria.ru/world/20140515/189849645/OPINION-Italy-Ignores-Veneto-Self-Determination-as-US-EU-Ignore.html","RIA","OPINION: Italy Ignores Veneto Self-Determination as US, EU Ignore Ukraine Federalization","2014-05-15T16:11:00.0"
"http://en.ria.ru/world/20140515/189849473/Kiev-Has-Done-Nothing-to-Launch-Constitutional-Process--Russian.html","RIA","Kiev Has Done Nothing to Launch Constitutional Process – Russian Foreign Ministry","2014-05-15T16:05:00.0"
"http://en.ria.ru/russia/20140515/189849292/Russia-Calls-Kiev-Irresponsible-for-Decision-to-Cut-Water.html","RIA","Russia Calls Kiev Irresponsible for Decision to Cut Water Supplies to Crimea","2014-05-15T16:04:00.0"
"http://en.ria.ru/world/20140515/189848505/Kiev-Pressuring-OSCE-Mission-in-Ukraine--Russian-Envoy.html","RIA","Kiev Pressuring OSCE Mission in Ukraine – Russian Envoy","2014-05-15T15:39:00.0"
"http://en.ria.ru/russia/20140515/189848416/No-Info-From-Kiev-on-Investigation-Into-Odessa-Tragedy--Moscow.html","RIA","No Info From Kiev on Investigation Into Odessa Tragedy – Moscow","2014-05-15T15:34:00.0"
"http://en.ria.ru/world/20140515/189847689/OPINION-US-and-NATO-Triggered-Crisis-in-Ukraine.html","RIA","OPINION: US and NATO Triggered Crisis in Ukraine","2014-05-15T15:15:00.0"
"http://en.ria.ru/world/20140515/189847550/OPINION-Governments-Betray-Responsibility-Under-UN-Convention.html","RIA","OPINION: Governments Betray Responsibility Under UN Convention Against Torture","2014-05-15T15:06:00.0"
"http://en.ria.ru/world/20140515/189846200/Kiev-Demands-Return-of-2Bln-Cubic-Meters-of-Russian-Gas-Left-in.html","RIA","Kiev Demands Return of 2Bln Cubic Meters of Russian Gas Left in Crimea Storage","2014-05-15T13:59:00.0"
"http://en.itar-tass.com/russia/731804?utm_medium=rss20","TASS","Russia to target markets of countries that bought arms from US, Europe","2014-05-15T18:44:57.0"
"http://en.itar-tass.com/russia/731801?utm_medium=rss20","TASS","Russia to advance Yak-130 aircraft to Mongolia, Vietnam, Latin America","2014-05-15T18:24:57.0"
"http://en.itar-tass.com/russia/731798?utm_medium=rss20","TASS","Defense cooperation agency denies Iraq plans to break up contract with Russia","2014-05-15T18:15:37.0"
"http://en.itar-tass.com/world/731796?utm_medium=rss20","TASS","China may use Ukrainian events to derive n-arms control benefits — expert","2014-05-15T18:03:28.0"
"http://en.itar-tass.com/economy/731791?utm_medium=rss20","TASS","Russia expects 0.8% slowdown of fixed assets investment fall in Q4","2014-05-15T17:39:13.0"
"http://en.itar-tass.com/world/731794?utm_medium=rss20","TASS","OSCE monitoring mission needs broader representation in Ukraine — Russian envoy","2014-05-15T17:03:40.0"
"http://en.itar-tass.com/economy/731788?utm_medium=rss20","TASS","Putin expects more active EU role in solving Ukraine gas debt problem","2014-05-15T16:48:59.0"
"http://en.itar-tass.com/world/731784?utm_medium=rss20","TASS","Moscow urges OSCE Special Monitoring Mission to be more objective in Ukraine","2014-05-15T16:37:23.0"
"http://en.itar-tass.com/economy/731776?utm_medium=rss20","TASS","Russia unable to stop using dollar in international trade —  economics minister","2014-05-15T16:13:46.0"
"http://en.itar-tass.com/world/731770?utm_medium=rss20","TASS","Ukraine’s gas debt grows to $3 billion — Russian President","2014-05-15T15:14:10.0"
"http://en.itar-tass.com/world/731760?utm_medium=rss20","TASS","Russia concerned over Ukraine’s use of helicopters without UN authorisation","2014-05-15T14:33:19.0"
"http://en.itar-tass.com/world/731749?utm_medium=rss20","TASS","Kiev unable to bring Donbass under control, stop bloodshed — Party of Regions","2014-05-15T14:22:22.0"
"http://en.itar-tass.com/world/731744?utm_medium=rss20","TASS","For Visa, MasterCard cheaper to quit Russia than to stay — Morgan Stanley","2014-05-15T13:15:00.0"
"http://feeds.reuters.com/~r/Reuters/worldNews/~3/QVRq1idx-g8/story01.htm","REUTERS","In opinion shift, poll says most Britons would vote to stay in EU","2014-05-15T19:06:52.0"
"http://feeds.reuters.com/~r/Reuters/worldNews/~3/kEyuyVfck5U/story01.htm","REUTERS","U.S. releases 10 Pakistanis from Afghanistan's Bagram prison","2014-05-15T19:05:08.0"
"http://en.itar-tass.com/russia/731817?utm_medium=rss20","TASS","Russian MP says contacts between Russian, Ukrainian parliaments possible after May 25","2014-05-15T19:24:40.0"
"http://en.itar-tass.com/world/731816?utm_medium=rss20","TASS","Russia calls for determining date of new round of Syria talks in Geneva","2014-05-15T19:21:41.0"
"http://en.itar-tass.com/russia/731809?utm_medium=rss20","TASS","Lavrov will speak at International Security Conference in Moscow","2014-05-15T19:03:33.0"
"http://en.itar-tass.com/world/731807?utm_medium=rss20","TASS","Major European company to make reverse gas supplies to Ukraine through Hungary","2014-05-15T19:02:04.0"
"http://en.itar-tass.com/russia/731805?utm_medium=rss20","TASS","Russian Foreign Ministry voices concern over deterioration of situation in Ukraine","2014-05-15T18:57:18.0"
"http://feeds.washingtonpost.com/c/34656/f/636535/s/3a76e928/sc/4/l/0L0Swashingtonpost0N0Cblogs0Cworldviews0Cwp0C20A140C0A50C150Ca0Erestroom0Ethat0Elooks0Elike0Ethe0Eu0Es0Ecapitol0Eyes0Etheres0Eone0Ein0Echina0C/story01.htm","WP","A restroom that looks like the U.S. Capitol? Yes, there’s one in China.","2014-05-15T20:11:31.0"
"http://en.itar-tass.com/world/731827?utm_medium=rss20","TASS","Friends of Syria Group meeting in London disappoints Russia","2014-05-15T19:52:23.0"
"http://rt.com/news/159284-lithuania-ban-energy-drinks-teens/","RT","Lithuania becomes first EU country to ban energy drink sales to teens","2014-05-15T23:03:59.0"
"http://en.itar-tass.com/world/731846?utm_medium=rss20","TASS","Roundtable on settlement of Ukrainian crisis to be held in Donetsk or Kharkov","2014-05-15T22:36:59.0"
"http://rt.com/usa/159308-obama-nobel-prize-norway/","RT","?White House was embarrassed by 'fawning' 2009 Nobel Prize – Norwegian diplomat","2014-05-16T02:18:08.0"
"http://news.xinhuanet.com/english/world/2014-05/16/c_133337205.htm","XINHUA","<a href='http://news.xinhuanet.com/english/world/2014-05/16/c_133337205.htm' target='_blank'>U.S., EU allies to impose wider sanctions if Russia disrupts Ukrainian elections: Kerry</a>","2014-05-16T02:00:00.0"
"http://feeds.reuters.com/~r/Reuters/worldNews/~3/NNrJCKcz6vQ/story01.htm","REUTERS","U.S. warns China its actions in sea disputes are straining relations","2014-05-16T05:26:22.0"
"http://feeds.reuters.com/~r/Reuters/worldNews/~3/dqx2rzdEXz4/story01.htm","REUTERS","Exclusive: Canada trimmed Russia sanctions to protect business interests","2014-05-16T07:06:55.0"
"http://feeds.reuters.com/~r/Reuters/worldNews/~3/5VYQHxFaZ9I/story01.htm","REUTERS","U.N. monitors warn on human rights in East Ukraine and Crimea","2014-05-16T10:36:29.0"
"http://feeds.reuters.com/~r/Reuters/worldNews/~3/DPRZKMxSsUU/story01.htm","REUTERS","Cold-shouldered by West, Putin will hope for some China sympathy","2014-05-16T10:13:52.0"
"http://feeds.reuters.com/~r/Reuters/worldNews/~3/HQhpUQQZ0e4/story01.htm","REUTERS","Fortune threatened, Ukraine's richest man joins the fray","2014-05-16T08:06:17.0"
"http://en.ria.ru/world/20140516/189865599/OPINION-US-Intervention-in-Ukraine-Arrogant-Heavy-Handed.html","RIA","OPINION: US Intervention in Ukraine Arrogant, Heavy-Handed","2014-05-16T10:18:56.0"
"http://en.ria.ru/world/20140516/189865347/EU-Reluctant-to-Join-US-Craze-About-HIV-Prevention-Pills.html","RIA","EU Reluctant to Join US Craze About HIV Prevention Pills","2014-05-16T10:11:06.0"
"http://en.ria.ru/world/20140516/189864801/EU-Urges-Companies-to-Pump-Gas-to-Ukraine-Facilities--Report.html","RIA","EU Urges Companies to Pump Gas to Ukraine Facilities – Report","2014-05-16T09:38:55.0"
"http://en.ria.ru/world/20140516/189863928/Canada-Eases-Russia-Sanctions-to-Defend-Business-Interests-.html","RIA","Canada Eases Russia Sanctions to Defend Business Interests – Report","2014-05-16T08:53:24.0"
"http://en.itar-tass.com/world/731588?utm_medium=rss20","TASS","Standoff in eastern Ukraine","2014-05-16T08:40:00.0"
"http://rt.com/news/159388-un-report-ukraine-criticism/","RT","U.N. Ukraine report shows double standards to whitewash Kiev authorities - Russia","2014-05-16T11:13:38.0"
"http://en.itar-tass.com/russia/731887?utm_medium=rss20","TASS","Moscow regrets that UN report on Ukraine justifies punitive operation in southeast","2014-05-16T11:27:09.0"
"http://en.itar-tass.com/russia/731882?utm_medium=rss20","TASS","Twitter can be blocked in Russia — watchdog","2014-05-16T10:46:11.0"
"http://feeds.reuters.com/~r/Reuters/worldNews/~3/w_IT6nQD5r8/story01.htm","REUTERS","UK Labour leader Ed Miliband embarrassed by U.S. adviser's gaffe","2014-05-16T15:30:39.0"
"http://feeds.reuters.com/~r/Reuters/worldNews/~3/kq5bxDF1EK0/story01.htm","REUTERS","U.S. concerned at lack of headway in Iran nuclear talks","2014-05-16T14:06:27.0"
"http://feeds.reuters.com/~r/Reuters/worldNews/~3/F_gJvu5PWMU/story01.htm","REUTERS","U.S. says concerned at lack of progress in Iran nuclear talks","2014-05-16T12:49:17.0"
"http://en.ria.ru/world/20140516/189872200/Ukraine-Banned-Entry-of-20000-Russians-Since-Regime-Change.html","RIA","Ukraine Banned Entry of 20,000 Russians Since Regime Change","2014-05-16T15:59:00.0"
"http://en.ria.ru/russia/20140516/189871519/Crimeans-Not-Bargaining-Chip-in-Russia-Ukraine-Disputes--Putin.html","RIA","Crimeans Not Bargaining Chip in Russia-Ukraine Disputes – Putin","2014-05-16T15:43:00.0"
"http://en.ria.ru/world/20140516/189870018/127-Killed-in-Kievs-Special-Op-in-Southeast-Ukraine--UN-Official.html","RIA","127 Killed in Kiev’s Special Op in Southeast Ukraine – UN Official","2014-05-16T14:32:00.0"
"http://en.ria.ru/world/20140516/189869562/Russia-European-Commission-Ukraine-May-Hold-Gas-Talks-on-May-26.html","RIA","Russia, European Commission, Ukraine May Hold Gas Talks on May 26","2014-05-16T14:15:00.0"
"http://en.ria.ru/world/20140516/189868742/US-Concerned-by-Lack-of-Progress-at-Iran-Nuclear-Talks.html","RIA","US Concerned by Lack of Progress at Iran Nuclear Talks","2014-05-16T13:28:00.0"
"http://en.ria.ru/russia/20140516/189868652/UN-Report-on-Ukraine-Attempts-to-Justify-Punitive-Op-on.html","RIA","UN Report on Ukraine Attempts to Justify Punitive Op on Protesters – Russian Foreign Ministry","2014-05-16T13:22:00.0"
"http://en.ria.ru/world/20140516/189866647/ANALYSIS-Seeing-Russia-Standing-in-Path-of-Western-Imperialism.html","RIA","ANALYSIS: Seeing Russia Standing in Path of Western Imperialism, US Destabilizes Ukraine","2014-05-16T11:39:00.0"
"http://en.itar-tass.com/russia/731937?utm_medium=rss20","TASS","Moscow calls on OSCE to be unbiased in assessing human rights situation in Ukraine","2014-05-16T16:08:12.0"
"http://en.itar-tass.com/economy/731921?utm_medium=rss20","TASS","Russia ready to give gas discount to Ukraine if debt partially paid off - energy minister","2014-05-16T14:33:00.0"
"http://en.itar-tass.com/economy/731914?utm_medium=rss20","TASS","Next trilateral talks on Ukraine’s gas issue likely to be held May 26","2014-05-16T14:19:56.0"
"http://en.itar-tass.com/world/731915?utm_medium=rss20","TASS","Ukraine's next national roundtable to take place on May 17 in Kharkiv","2014-05-16T14:16:02.0"
"http://en.itar-tass.com/world/731910?utm_medium=rss20","TASS","Drug addicts among Ukraine’s Maidan protesters — official","2014-05-16T13:53:44.0"
"http://en.itar-tass.com/russia/731905?utm_medium=rss20","TASS","Crimean Tatars should not be small coin in disputes between Russia and Ukraine — Putin","2014-05-16T13:40:54.0"
"http://en.itar-tass.com/economy/731903?utm_medium=rss20","TASS","EU, Russia and Ukraine may discuss Kiev's gas debt on May 26","2014-05-16T13:18:22.0"
"http://en.itar-tass.com/world/731898?utm_medium=rss20","TASS","Visa-free regime between EU and Ukraine can be introduced by mid-2015 — Polish FM","2014-05-16T12:34:09.0"
"http://rt.com/news/159468-ukraine-shoot-army-journalist/","RT","Kiev troops open fire on RT journalist near Kramatorsk (VIDEO)","2014-05-16T17:04:11.0"
"http://en.ria.ru/world/20140516/189874503/ANALYSIS-US-Policy-Toward-Iran-Remains-Unchanged-Tied-to-Israel.html","RIA","ANALYSIS: US Policy Toward Iran Remains Unchanged, Tied to Israel, Saudi Arabia","2014-05-16T17:04:17.0"
"http://en.ria.ru/world/20140516/189874250/Russian-Diplomat-Says-OSCE-Report-on-Ukraine-Ignores-Govts.html","RIA","Russian Diplomat Says OSCE Report on Ukraine Ignores Govt's Violation of Human Rights","2014-05-16T16:59:00.0"
"http://en.ria.ru/world/20140516/189873815/Italian-Peace-Activists-to-Protest-Against-EU-Support-For.html","RIA","Italian Peace Activists to Protest Against EU Support For Ukraine","2014-05-16T16:57:00.0"
"http://en.ria.ru/world/20140516/189873660/New-Egyptian-President-to-Boost-Ties-With-Russia--Egyptian.html","RIA","New Egyptian President to Boost Ties With Russia – Egyptian Foreign Ministry","2014-05-16T16:31:16.0"
"http://en.ria.ru/world/20140516/189873233/Operation-American-Spring-Seeks-to-Oust-Obama.html","RIA","Operation American Spring Seeks to Oust Obama","2014-05-16T16:25:00.0"
"http://en.ria.ru/russia/20140516/189871074/Russia-China-Gas-Talks-Influenced-by-Strained-Russia-West.html","RIA","Russia, China Gas Talks Influenced by Strained Russia-West Relations","2014-05-16T14:10:00.0"
"http://en.ria.ru/world/20140516/189873361/INTERVIEW-US-Power-Elites-Addicted-to-Money-Blind-to-Resulting.html","RIA","INTERVIEW: US Power Elites Addicted to Money, Blind to Resulting Harm","2014-05-16T12:09:00.0"
"http://rt.com/business/159480-russia-canada-sanctions-sechin/","RT","Saving business: Canada chooses not to sanction Russia’s Rosneft, Rostec bosses","2014-05-16T17:51:47.0"
"http://feeds.reuters.com/~r/Reuters/worldNews/~3/njmYVDOhyfo/story01.htm","REUTERS","Russian PM criticizes official for threats to block Twitter","2014-05-16T17:51:58.0"
"http://en.itar-tass.com/world/731956?utm_medium=rss20","TASS","Cyprus comes against West’s economic sanctions on Russia","2014-05-16T18:10:00.0"
"http://en.itar-tass.com/russia/731969?utm_medium=rss20","TASS","Russian officials reacted on Western sanctions right and calmly — Kremlin official","2014-05-16T19:35:38.0"
"http://rt.com/news/159508-kiev-terrorist-organizations-donetsk/","RT","Kiev proclaims post-referendum Donetsk, Lugansk regions ‘terrorist organizations’","2014-05-16T21:10:12.0"
"http://en.itar-tass.com/world/731979?utm_medium=rss20","TASS","German-Russian trade chamber warns of major impact of EU sanctions against Russia","2014-05-16T20:58:01.0"
"http://rt.com/usa/159512-quarter-bee-population-dead/","RT","US honeybee population suffers 'unsustainable' death rate over the winter","2014-05-16T22:11:18.0"
"http://rt.com/news/159556-drone-smuggling-cigarette-lithuania/","RT","Smoking, not spying: Russia intercepts Lithuanian cigarette-smuggling drone","2014-05-17T00:29:57.0"
"http://news.xinhuanet.com/english/world/2014-05/17/c_133339987.htm","XINHUA","<a href='http://news.xinhuanet.com/english/world/2014-05/17/c_133339987.htm' target='_blank'>Obama, Hollande reiterate threat of more sanctions on Russia over Ukraine</a>","2014-05-17T02:00:00.0"
"http://feeds.reuters.com/~r/Reuters/worldNews/~3/EzuWg0aDtm8/story01.htm","REUTERS","Ukrainian foreign minister calls on West to impose tougher sanctions on Russia","2014-05-17T02:32:32.0"
"http://feeds.reuters.com/~r/Reuters/worldNews/~3/FqAw_xdQMhY/story01.htm","REUTERS","Obama's Asia pivot tested by China's bold maritime claims","2014-05-17T02:05:21.0"
"http://rt.com/usa/159572-judge-halts-force-feeding/","RT","US judge temporarily halts force-feeding of Guantanamo prisoner","2014-05-17T06:21:52.0"
"http://en.itar-tass.com/world/732008?utm_medium=rss20","TASS","Russia insists on immediate ending of combat actions in southeastern Ukraine","2014-05-17T12:59:58.0"
"http://rt.com/news/159588-east-ukraine-shale-deposits/","RT","Shale gas and politics: Are Western energy giants’ interests behind Ukraine violence?","2014-05-17T15:08:33.0"
"http://en.itar-tass.com/world/732025?utm_medium=rss20","TASS","Ukraine seeks constructive border cooperation with Russia","2014-05-17T19:21:46.0"
"http://feeds.reuters.com/~r/Reuters/worldNews/~3/5JwcSrrfdiU/story01.htm","REUTERS","EU will not monitor Egypt vote after equipment blocked: official","2014-05-17T21:21:12.0"
"http://en.itar-tass.com/russia/732027?utm_medium=rss20","TASS","Russian, Slovak foreign ministers will discuss Ukraine on May 18-19","2014-05-17T21:26:34.0"
"http://en.itar-tass.com/world/732032?utm_medium=rss20","TASS","Hundreds of Italians protested against media’s distorted coverage of Ukraine crisis","2014-05-17T22:59:50.0"
"http://rt.com/news/159664-italy-protest-nazism-ukraine/","RT","'No to the Nazi coup d'etat in Ukraine!' Rome protesters rally against fascism","2014-05-18T00:30:01.0"
"http://news.xinhuanet.com/english/world/2014-05/18/c_133341552.htm","XINHUA","<a href='http://news.xinhuanet.com/english/world/2014-05/18/c_133341552.htm' target='_blank'>Obama calls outgoing Indian premier</a>","2014-05-18T02:00:00.0"
"http://en.itar-tass.com/russia/732035?utm_medium=rss20","TASS","Russia marks International Museum Day","2014-05-18T03:12:10.0"
"http://rt.com/news/159680-eu-thousands-protest-austerity/","RT","Thousands across Europe rally against EU policies (VIDEOS)","2014-05-18T05:07:45.0"
"http://feeds.reuters.com/~r/Reuters/worldNews/~3/nu3u0nEfTT8/story01.htm","REUTERS","Ukraine crisis will be 'game changer' for NATO","2014-05-18T09:13:21.0"
"http://rt.com/news/159716-germany-sanctions-russia-criticism/","RT","German FM calls for ‘cooperation instead confrontation’ with Russia","2014-05-18T12:18:51.0"
"http://en.itar-tass.com/world/732060?utm_medium=rss20","TASS","Ukraine law enforcers detain Russian TV journalists in south-eastern region","2014-05-18T13:29:57.0"
"http://rt.com/news/159744-lifenews-journalists-detained-ukraine/","RT","Russian journalists ‘detained’ near Kramatorsk in E. Ukraine","2014-05-18T13:53:04.0"
"http://feeds.reuters.com/~r/Reuters/worldNews/~3/7wICSoO5Qw4/story01.htm","REUTERS","Russia, Europe join volunteers in Balkan flood relief effort","2014-05-18T13:41:04.0"
"http://rt.com/op-edge/159796-putin-empire-ukraine-west/","RT","Putin and the mythical empire","2014-05-18T19:02:45.0"
"http://rt.com/news/159792-us-base-croughton-uk/","RT","US to spend $317 million on British intel hub upgrade - report","2014-05-18T19:24:03.0"
"http://en.itar-tass.com/russia/732073?utm_medium=rss20","TASS","LifeNews TV asks Lavrov to help free reporters detained in Ukraine","2014-05-18T19:53:24.0"
"http://rt.com/news/159804-putin-china-visit-interview/","RT","Russia-China ties at highest level in history – Putin","2014-05-18T22:06:25.0"
"http://rt.com/news/159800-tsarev-ukraine-crisis-election/","RT","Kiev Nazi authorities are only obstacle to peace in Ukraine – ex-presidential candidate","2014-05-18T22:02:54.0"
"http://rt.com/news/159812-russia-journalists-ukraine-osce/","RT","Moscow demands OSCE take measures to free journalists detained by Kiev","2014-05-18T21:26:16.0"
"http://rt.com/news/159816-kiev-army-shell-kramatorsk/","RT","Kiev army shells Kramatorsk, city ‘left without water’ – self-defense coordinator","2014-05-18T22:17:40.0"
"http://rt.com/news/159840-lugansk-elects-head-constitution/","RT","Self-proclaimed Lugansk People's Republic elects head, passes constitution","2014-05-19T05:56:10.0"
"http://en.itar-tass.com/economy/732093?utm_medium=rss20","TASS","Putin: Russia interested in China's participation in developing of Far East","2014-05-19T06:38:08.0"
"http://en.itar-tass.com/world/732100?utm_medium=rss20","TASS","Lavrov urges OSCE to use all possibilities to release Russian TV journalists in Ukraine","2014-05-19T07:32:36.0"
"http://en.ria.ru/world/20140519/189929711/Donetsk-Peoples-Republic-Plans-No-Talks-With-Kiev-Regime.html","RIA","Donetsk People’s Republic Plans No Talks With Kiev Regime","2014-05-19T09:43:00.0"
"http://en.ria.ru/russia/20140519/189929450/Ukraine-Violating-Media-Freedom-by-Arresting-Journalists-.html","RIA","Ukraine Violating Media Freedom by Arresting Journalists – Russian Foreign Ministry","2014-05-19T09:36:00.0"
"http://en.ria.ru/russia/20140519/189929111/Lavrov-Urges-OSCE-to-Help-Release-Russian-Journalists-in-Ukraine.html","RIA","Lavrov Urges OSCE to Help Release Russian Journalists in Ukraine","2014-05-19T09:09:00.0"
"http://en.ria.ru/world/20140519/189931128/EU-to-Work-With-Russia-on-Ukraine-Crisis-Settlement-No-New.html","RIA","EU to Work With Russia on Ukraine Crisis Settlement, No New Sanctions Planned","2014-05-19T10:15:00.0"
