"Url","Source","Title","Published"
"http://en.itar-tass.com/world/731086?utm_medium=rss20","TASS","Japanese official visited Moscow to talk about Ukraine","2014-05-10T14:13:20.0"
"http://en.ria.ru/world/20140510/189720418/Right-Wing-British-MEP-Blames-UK-Government-for-Ukraine-Crisis.html","RIA","Right Wing British MEP Blames UK Government for Ukraine Crisis","2014-05-10T12:40:00.0"
"http://en.itar-tass.com/russia/731094?utm_medium=rss20","TASS","Moscow court sanctions rape case suspect's arrest","2014-05-10T15:29:56.0"
"http://rt.com/op-edge/158112-ukrainian-crisis-way-solution/","RT","?Ukrainian crisis: The way toward a solution","2014-05-10T16:18:51.0"
"http://feeds.reuters.com/~r/Reuters/worldNews/~3/NfyEgFN88rM/story01.htm","REUTERS","Nigerian army posts two divisions to hunt for missing girls","2014-05-10T16:08:30.0"
"http://en.itar-tass.com/sports/731099?utm_medium=rss20","TASS","Putin scores 6 times in final game of Night Hockey League festival in Sochi","2014-05-10T16:31:25.0"
"http://en.itar-tass.com/world/731098?utm_medium=rss20","TASS","Merkel, Hollande urge Kiev to begin national dialogue with regions","2014-05-10T16:20:51.0"
"http://en.itar-tass.com/russia/731103?utm_medium=rss20","TASS","Russian delegation makes new attempt to return home from Moldova","2014-05-10T18:26:46.0"
"http://rt.com/news/158096-ukraine-referendum-donetsk-lugansk/","RT","E. Ukraine’s regions gear up for independence referendums","2014-05-10T19:05:15.0"
"http://feeds.reuters.com/~r/Reuters/worldNews/~3/aX4fIvYBV3Q/story01.htm","REUTERS","Two U.S. embassy officers involved in Yemen firefight, left Sanaa","2014-05-10T19:18:56.0"
"http://feeds.reuters.com/~r/Reuters/worldNews/~3/eq4rF8Ys4sI/story01.htm","REUTERS","Venezuela's Maduro rails at 'stupid' U.S. sanctions calls","2014-05-10T20:08:13.0"
"http://rt.com/op-edge/158100-ukraine-nato-us-drills/","RT","US upping the ante in terms of brinkmanship in Eastern Europe","2014-05-10T20:51:59.0"
"http://rt.com/business/158128-us-loan-guarantees-ukraine/","RT","US authorizes $1bn to Ukraine in loan guarantees","2014-05-10T20:51:07.0"
"http://edition.cnn.com/2014/05/10/world/meast/yemen-qaeda-kidnapping-attempt-us-embassy/index.html?eref=edition","CNN","Source: U.S. gunman kills 2 in Yemen","2014-05-10T21:47:11.0"
"http://en.itar-tass.com/world/731117?utm_medium=rss20","TASS","Donetsk, Lugansk regions to hold referendums on self-determination","2014-05-11T01:26:56.0"
"http://rt.com/op-edge/158156-ukraine-escalation-civil-war/","RT","?Ukraine ‘escalation ladder’ leads to wider war","2014-05-11T02:00:35.0"
"http://en.itar-tass.com/world/731122?utm_medium=rss20","TASS","Venezuela says won’t recognize Kiev authorities until free elections in Ukraine","2014-05-11T05:59:45.0"
"http://rt.com/news/158160-lugansk-donetsk-referendum-vote/","RT","Lugansk and Donetsk regions vote for self-determination","2014-05-11T07:02:39.0"
"http://feeds.reuters.com/~r/Reuters/worldNews/~3/ER6oX_0Mm5A/story01.htm","REUTERS","Ukraine warns of 'abyss' as rebel east approaches self-rule vote","2014-05-11T06:57:12.0"
"http://edition.cnn.com/video/data/2.0/video/world/2014/05/10/pkg-paton-walsh-slovyansk-referendum.cnn.html?eref=edition","CNN","Slovyansk faces decision","2014-05-11T07:36:47.0"
"http://edition.cnn.com/2014/05/11/world/europe/ukraine-crisis/index.html?eref=edition","CNN","Separatists hold controversial vote in Ukraine","2014-05-11T08:38:51.0"
"http://edition.cnn.com/2014/05/11/world/europe/eurovision-ukraine-russia-conchita-wurst/index.html?eref=edition","CNN","Austria's 'bearded lady' wins Eurovision","2014-05-11T08:46:40.0"
"http://en.itar-tass.com/world/731132?utm_medium=rss20","TASS","Southeast Ukraine’s Lugansk referendum turnout at around 22% as of 8am BST","2014-05-11T10:00:07.0"
"http://rt.com/news/158184-kiev-attack-referendum-lugansk/","RT","Kiev’s armored vehicles attack village nr Ukraine’s Lugansk – self-defense forces","2014-05-11T10:47:44.0"
"http://rt.com/business/158196-crimea-invest-offshore-russia/","RT","?Russia’s ‘civilized’ offshore? Moscow allocates $1.5 bn for Crimea","2014-05-11T13:49:27.0"
"http://en.itar-tass.com/world/731148?utm_medium=rss20","TASS","Ukraine law enforcers block ballot delivery at southeast Ukraine referendum","2014-05-11T13:49:31.0"
"http://en.itar-tass.com/world/731156?utm_medium=rss20","TASS","Ukraine law enforcers continue punitive operation in southeast Ukraine","2014-05-11T16:23:08.0"
"http://rt.com/news/158212-academi-blackwater-ukraine-military/","RT","400 US mercenaries 'deployed on ground' in Ukraine military op","2014-05-11T17:04:55.0"
"http://rt.com/news/158236-afghanistan-refugee-camps-war/","RT","Never-ending war: Thousands of Afghans displaced ahead of US withdrawal","2014-05-11T16:23:33.0"
"http://www.rt.com/news/158212-academi-blackwater-ukraine-military/","RT","400 US mercenaries 'deployed on ground' in Ukraine military op","2014-05-11T17:04:55.0"
"http://www.rt.com/news/158236-afghanistan-refugee-camps-war/","RT","Never-ending war: Thousands of Afghans displaced ahead of US withdrawal","2014-05-11T16:23:33.0"
"http://www.rt.com/business/158196-crimea-invest-offshore-russia/","RT","?Russia’s ‘civilized’ offshore? Moscow allocates $1.5 bn for Crimea","2014-05-11T13:49:27.0"
"http://www.rt.com/news/158184-kiev-attack-referendum-lugansk/","RT","Kiev’s troops roll through E.Ukraine in ‘bid to disrupt voting’ – self-defense forces","2014-05-11T10:47:44.0"
"http://www.rt.com/news/158160-lugansk-donetsk-referendum-vote/","RT","Lugansk and Donetsk regions vote for self-determination","2014-05-11T07:02:39.0"
"http://www.rt.com/op-edge/158156-ukraine-escalation-civil-war/","RT","?Ukraine ‘escalation ladder’ leads to wider war","2014-05-11T02:00:35.0"
"http://www.rt.com/op-edge/158100-ukraine-nato-us-drills/","RT","US upping the ante in terms of brinkmanship in Eastern Europe","2014-05-10T20:51:59.0"
"http://www.rt.com/business/158128-us-loan-guarantees-ukraine/","RT","US authorizes $1bn to Ukraine in loan guarantees","2014-05-10T20:51:07.0"
"http://www.rt.com/news/158096-ukraine-referendum-donetsk-lugansk/","RT","E. Ukraine’s regions gear up for independence referendums","2014-05-10T19:05:15.0"
"http://en.itar-tass.com/world/731170?utm_medium=rss20","TASS","Wounded Kharkov mayor calls on Russia, Ukraine to be moving towards each other","2014-05-11T19:25:49.0"
"http://rt.com/usa/158268-cia-brennan-ukraine-visit/","RT","?CIA director admits he visited Kiev, refuses to call Russia enemy","2014-05-12T00:10:03.0"
"http://rt.com/news/158276-referendum-results-east-ukraine/","RT","Early results show landslide support in Donetsk and Lugansk regions for self-rule","2014-05-12T01:40:12.0"
"http://news.xinhuanet.com/english/world/2014-05/11/c_133325118.htm","XINHUA","<a href='http://news.xinhuanet.com/english/world/2014-05/11/c_133325118.htm' target='_blank'>Referendums kick off in Ukraine's Donetsk, Lugansk </a>","2014-05-11T02:00:00.0"
"http://news.xinhuanet.com/english/world/2014-05/11/c_126484936.htm","XINHUA","<a href='http://news.xinhuanet.com/english/world/2014-05/11/c_126484936.htm' target='_blank'>Russia demanded of more de-escalation signals over Ukraine crisis</a>","2014-05-11T02:00:00.0"
"http://news.xinhuanet.com/english/world/2014-05/10/c_133324196.htm","XINHUA","<a href='http://news.xinhuanet.com/english/world/2014-05/10/c_133324196.htm' target='_blank'>Hamas rejects U.S. demands of Palestinian recognition of Israel</a>","2014-05-11T02:00:00.0"
"http://news.xinhuanet.com/english/world/2014-05/11/c_126484920.htm","XINHUA","<a href='http://news.xinhuanet.com/english/world/2014-05/11/c_126484920.htm' target='_blank'>1 killed in U.S. hot air balloon crash, 2 missing</a>","2014-05-11T02:00:00.0"
"http://feeds.reuters.com/~r/Reuters/worldNews/~3/SM4qRduOPbM/story01.htm","REUTERS","Rebels declare victory in East Ukraine vote on self-rule","2014-05-12T03:02:07.0"
"http://news.xinhuanet.com/english/photo/2014-05/12/c_133325940.htm","XINHUA","<a href='http://news.xinhuanet.com/english/photo/2014-05/12/c_133325940.htm' target='_blank'>Eastern Ukrainians vote for independence</a>","2014-05-12T02:00:00.0"
"http://news.xinhuanet.com/english/world/2014-05/12/c_133325879.htm","XINHUA","<a href='http://news.xinhuanet.com/english/world/2014-05/12/c_133325879.htm' target='_blank'>French president denounces Eastern Ukraine referendums as invalid</a>","2014-05-12T02:00:00.0"
"http://rt.com/op-edge/158284-referendum-east-ukraine-us/","RT","US hypocritical when democracy goes against it","2014-05-12T06:04:40.0"
"http://en.itar-tass.com/world/731191?utm_medium=rss20","TASS","Japan to take into account other G7 states’ views on peace treaty talks with Russia","2014-05-12T06:52:48.0"
"http://en.itar-tass.com/world/731187?utm_medium=rss20","TASS","EU FMs to discuss situation in Ukraine's east and possible new sanctions against Russia","2014-05-12T06:20:36.0"
"http://en.itar-tass.com/world/731195?utm_medium=rss20","TASS","US official travels to Europe to express support for Ukraine's presidential elections","2014-05-12T07:44:51.0"
"http://www.rt.com/op-edge/158284-referendum-east-ukraine-us/","RT","US hypocritical when democracy goes against it","2014-05-12T06:04:40.0"
"http://www.rt.com/news/158276-referendum-results-east-ukraine/","RT","Referendum results in Donetsk region show landslide support for self-rule","2014-05-12T01:40:12.0"
"http://www.rt.com/usa/158268-cia-brennan-ukraine-visit/","RT","?CIA director admits he visited Kiev, refuses to call Russia enemy","2014-05-12T00:10:03.0"
"http://en.ria.ru/russia/20140512/189757404/Russia-May-Revise-Relations-with-Moldova-if-It-Moves-Closer-to.html","RIA","Russia May Revise Relations with Moldova if It Moves Closer to EU","2014-05-12T08:59:22.0"
"http://edition.cnn.com/2014/05/12/world/europe/ukraine-crisis/index.html?eref=edition","CNN","Pro-Russian separatists claim win in eastern Ukraine vote","2014-05-12T10:09:40.0"
"http://en.ria.ru/world/20140512/189758905/Japan-to-Continue-Discussions-With-Russia-on-WWII-Peace-Treaty.html","RIA","Japan to Continue Discussions With Russia on WWII Peace Treaty","2014-05-12T10:05:00.0"
"http://en.ria.ru/world/20140512/189758490/Referendum-in-Ukraine-Shows-Citizens-Distrust-Kiev--Russian.html","RIA","Referendum in Ukraine Shows Citizens Distrust Kiev – Russian Official","2014-05-12T09:54:00.0"
"http://en.itar-tass.com/russia/731218?utm_medium=rss20","TASS","Russia wants to be useful in conflict settlement in Africa — Lavrov","2014-05-12T10:31:01.0"
"http://rt.com/usa/158288-govt-failed-inspect-wells/","RT","US govt failed to inspect ‘high risk’ oil & gas wells","2014-05-12T10:34:31.0"
"http://en.ria.ru/world/20140512/189761252/US-Agencies-Withhold-Info-on-Cyber-Threats-From-Companies-.html","RIA","US Agencies Withhold Info on Cyber Threats From Companies – Report","2014-05-12T11:22:00.0"
"http://en.ria.ru/world/20140512/189761804/EU-Officials-Refuse-to-Participate-in-Energy-Conference-With.html","RIA","EU Officials Refuse to Participate in Energy Conference With Russia","2014-05-12T11:15:00.0"
"http://en.ria.ru/world/20140512/189759988/Kiev-Has-No-Grounds-to-Contest-Referendums--Crimean-Official.html","RIA","Kiev Has No Grounds to Contest Referendums – Crimean Official","2014-05-12T10:35:00.0"
"http://en.itar-tass.com/world/731230?utm_medium=rss20","TASS","Ukraine situation posing possible threat to global economy, IMF head says","2014-05-12T11:14:37.0"
"http://en.itar-tass.com/russia/731225?utm_medium=rss20","TASS","No plans for new meetings on Ukraine — Lavrov","2014-05-12T10:54:47.0"
"http://en.itar-tass.com/world/731214?utm_medium=rss20","TASS","Moscow respects will  expressed by population of Donetsk and Luhansk regions of Ukraine","2014-05-12T10:33:51.0"
"http://rt.com/usa/158352-usstratcom-nuclear-wargames-nato/","RT","US starts countrywide nuclear drill after similar war games in Russia","2014-05-12T11:53:13.0"
"http://en.ria.ru/russia/20140512/189763050/Russias-Lavrov-Slams-Kiev-for-Using-Violence-to-Foil-Referendums.html","RIA","Russia’s Lavrov Slams Kiev for Using Violence to Foil Referendums","2014-05-12T12:11:00.0"
"http://en.ria.ru/russia/20140512/189762698/Moscow-Respects-Choice-of-Ukrainian-People-in-Referendums.html","RIA","Moscow Respects Choice of Ukrainian People in Referendums","2014-05-12T11:57:00.0"
"http://en.ria.ru/russia/20140512/189762086/Kiev-Must-Pay-Gas-Debt-for-Moscow-to-Discuss-Compromise--Russian.html","RIA","Kiev Must Pay Gas Debt for Moscow to Discuss Compromise – Russian Official","2014-05-12T11:23:00.0"
"http://en.itar-tass.com/world/731253?utm_medium=rss20","TASS","Yanukovych urges Kiev authorities to withdraw troops from eastern Ukraine","2014-05-12T13:03:19.0"
"http://en.itar-tass.com/world/731245?utm_medium=rss20","TASS","Channels should remain open for negotiations with Russia on Ukraine — Austrian FM","2014-05-12T12:53:37.0"
"http://en.itar-tass.com/world/731249?utm_medium=rss20","TASS","Ukraine crisis to be resolved ‘on basis of law and order’ - Chinese FM","2014-05-12T12:25:07.0"
"http://en.ria.ru/world/20140512/189765245/US-Fails-to-Inspect-High-Risk-Oil-Wells--Report.html","RIA","US Fails to Inspect High-Risk Oil Wells – Report","2014-05-12T13:59:00.0"
"http://en.ria.ru/world/20140512/189765104/Kiev-Accepts-OSCE-Proposal-of-German-Mediator-for-National.html","RIA","Kiev Accepts OSCE Proposal of German Mediator for National Dialogue","2014-05-12T13:54:00.0"
"http://en.ria.ru/world/20140512/189764465/US-Ukraine-Prevent-OSCE-Roadmap-Release--Lavrov.html","RIA","US, Ukraine Prevent OSCE Roadmap Release – Lavrov","2014-05-12T13:20:00.0"
"http://en.itar-tass.com/world/731270?utm_medium=rss20","TASS","FM: Italy backs efforts to establish national dialogue in Ukraine","2014-05-12T13:59:33.0"
"http://en.itar-tass.com/world/731262?utm_medium=rss20","TASS","Ukraine NATO membership against Belarus, Russia interests — Lukashenko","2014-05-12T13:28:10.0"
"http://rt.com/politics/158412-russia-duma-ukraine-referendum/","RT","State Duma factions welcome Ukraine referendum results","2014-05-12T15:06:19.0"
"http://feeds.reuters.com/~r/Reuters/worldNews/~3/__pcAnxFa5c/story01.htm","REUTERS","Kuwait minister accused by US of terrorism funding quits: report","2014-05-12T14:51:44.0"
"http://en.ria.ru/world/20140512/189767449/OSCE-Chair-Switzerland-Says-Second-Conference-on-Ukraine-Not.html","RIA","OSCE Chair Switzerland Says Second Conference on Ukraine Not Priority","2014-05-12T15:05:00.0"
"http://en.ria.ru/world/20140512/189767317/Ousted-Ukraine-Leader-Says-Fascism-Reigns-in-Country.html","RIA","Ousted Ukraine Leader Says Fascism Reigns in Country","2014-05-12T14:59:00.0"
"http://en.ria.ru/world/20140512/189767225/Ukraine-Should-Focus-on-Decentralization-Minority-Rights--OSCE.html","RIA","Ukraine Should Focus on Decentralization, Minority Rights – OSCE Chief","2014-05-12T14:58:00.0"
"http://en.ria.ru/russia/20140512/189766590/Russian-Parliament-Will-Consider-East-Ukraine-in-Relations-With.html","RIA","Russian Parliament Will Consider East Ukraine in Relations With Kiev","2014-05-12T14:43:00.0"
"http://en.ria.ru/world/20140512/189766412/Luhansk-Keeps-Open-Possibility-of-Referendum-on-Joining-Russia.html","RIA","Luhansk Keeps Open Possibility of Referendum on Joining Russia","2014-05-12T14:29:00.0"
"http://rt.com/news/158408-rt-cameraman-wounded-ukraine/","RT","Medical jet with wounded RT journalist lands in Moscow","2014-05-12T15:27:35.0"
"http://news.xinhuanet.com/english/world/2014-05/12/c_133328704.htm","XINHUA","<a href='http://news.xinhuanet.com/english/world/2014-05/12/c_133328704.htm' target='_blank'>Russia blames U.S., Ukraine for preventing OSCE roadmap release</a>","2014-05-12T02:00:00.0"
"http://en.ria.ru/world/20140512/189768249/Iran-Copies-Downed-US-Drone.html","RIA","Iran Copies Downed US Drone","2014-05-12T15:29:00.0"
"http://en.ria.ru/world/20140512/189767855/West-Should-Not-Use-Ukraine-to-Pressure-Russia--Belarusian.html","RIA","West Should Not Use Ukraine to Pressure Russia – Belarusian President","2014-05-12T15:21:00.0"
"http://en.ria.ru/world/20140512/189767606/EU-Agrees-to-Sanctions-Against-2-Crimean-Companies-13-Persons-.html","RIA","EU Agrees to Sanctions Against 2 Crimean Companies, 13 Persons – Source","2014-05-12T15:10:00.0"
"http://en.itar-tass.com/world/731293?utm_medium=rss20","TASS","Russia will be able to provide symmetric response to Ukrainian airspace ban","2014-05-12T16:04:17.0"
"http://en.itar-tass.com/world/731292?utm_medium=rss20","TASS","EU Council refuses to recognize referendum in Ukraine and expands sanctions vs. Russia","2014-05-12T15:46:40.0"
"http://rt.com/business/158444-russia-ukraine-gas-supplies/","RT","Gazprom to cut supplies to Ukraine from June if no prepayment","2014-05-12T17:21:56.0"
"http://rt.com/politics/158428-russia-ministry-caucasus-reshuffle/","RT","Russia introduces separate ministry for North Caucasus affairs","2014-05-12T17:18:04.0"
"http://rt.com/news/158436-donetsk-republic-ask-join-russia/","RT","Donetsk People's Republic asks Moscow to consider its accession into Russia","2014-05-12T16:30:20.0"
"http://rt.com/op-edge/158416-eastern-ukraine-referendum-expressing-will/","RT","'Eastern Ukrainians aren’t seeking separation, they’re expressing their will'","2014-05-12T16:05:16.0"
"http://edition.cnn.com/2014/05/12/world/meast/iran-u-s-drone-copy/index.html?eref=edition","CNN","Iran: We built copy of U.S. drone","2014-05-12T16:41:54.0"
"http://feeds.reuters.com/~r/Reuters/worldNews/~3/lpKhOqkr5Ug/story01.htm","REUTERS","Ukrainian separatist leader says looking to union with Russia","2014-05-12T17:11:27.0"
"http://en.ria.ru/world/20140512/189771916/EU-Foreign-Ministers-Call-For-Second-Geneva-Meeting-on-Ukraine.html","RIA","EU Foreign Ministers Call For Second Geneva Meeting on Ukraine","2014-05-12T17:05:11.0"
"http://en.ria.ru/russia/20140512/189769357/Russias-Aeroflot-Extends-Freeze-to-Ukraines-Donetsk-Kharkiv.html","RIA","Russia’s Aeroflot Extends Freeze to Ukraine’s Donetsk, Kharkiv","2014-05-12T16:06:00.0"
"http://en.itar-tass.com/russia/731305?utm_medium=rss20","TASS","Berlin’s decision to scale down dialogue with Russia to harm ties, Duma speaker says","2014-05-12T17:19:47.0"
"http://rt.com/usa/158448-ron-paul-us-involved-ukraine/","RT","Ron Paul: Why is US involved in Ukraine?","2014-05-12T17:44:32.0"
"http://feeds.reuters.com/~r/Reuters/worldNews/~3/kPKSHLGMTjc/story01.htm","REUTERS","Putin names general, new minister to insurgency-ridden Caucasus","2014-05-12T17:57:42.0"
"http://feeds.reuters.com/~r/Reuters/worldNews/~3/uGvhbh1pOwo/story01.htm","REUTERS","Ukraine separatists appeal to Moscow for absorption into Russia","2014-05-12T17:24:20.0"
"http://en.itar-tass.com/russia/731306?utm_medium=rss20","TASS","Medvedev: Russia has evidence Ukraine has money to pay gas debt","2014-05-12T17:26:35.0"
"http://rt.com/usa/158456-second-us-mers-case-confirmed/","RT","Second MERS case in US confirmed in Florida","2014-05-12T19:24:20.0"
"http://rt.com/news/158464-japan-us-drones-china/","RT","Japan-based US drones to spy on China, N. Korea – report","2014-05-12T19:18:22.0"
"http://rt.com/news/158468-france-russia-mistral-deal/","RT","France refuses to block Mistral warship deal with Russia","2014-05-12T19:17:36.0"
"http://en.itar-tass.com/russia/731319?utm_medium=rss20","TASS","Russia warns US against malicious distortions about CBTW","2014-05-12T19:27:28.0"
"http://feeds.reuters.com/~r/Reuters/worldNews/~3/Y-rz6dNHOnA/story01.htm","REUTERS","Iran prods Pakistan leader on U.S. ties, security, pipeline","2014-05-12T19:59:45.0"
"http://en.itar-tass.com/russia/731324?utm_medium=rss20","TASS","Russia demands Kiev’s explanations over denial of entry to church hierarch","2014-05-12T19:55:00.0"
"http://rt.com/news/158472-czech-nato-troops-ukraine/","RT","Czech Republic does not envisage NATO troops on its soil","2014-05-12T20:27:32.0"
"http://edition.cnn.com/2014/05/12/world/europe/ukraine-cnn-poll/index.html?eref=edition","CNN","CNN poll: Ukraine favors Europe not Russia","2014-05-12T21:10:43.0"
"http://feeds.reuters.com/~r/Reuters/worldNews/~3/Bd2qOAY_V60/story01.htm","REUTERS","Anti-immigrant Sweden Democrats struggle to rouse voters for EU polls","2014-05-12T20:20:40.0"
"http://en.itar-tass.com/russia/731326?utm_medium=rss20","TASS","Putin, Burkhalter discuss situation in Ukraine after Donetsk, Lugansk polls","2014-05-12T20:49:48.0"
"http://rt.com/news/158432-schroeder-russia-sanctions-eu/","RT","EU policy to blame for Ukraine crisis - Ex-Chancellor Schroeder","2014-05-12T21:23:26.0"
"http://en.itar-tass.com/russia/731328?utm_medium=rss20","TASS","Deputy of Duma: Donetsk, Lugansk referenda to set inspiring example for Ukrainian regions","2014-05-12T21:58:18.0"
"http://feeds.reuters.com/~r/Reuters/worldNews/~3/vLMNuVUkvRQ/story01.htm","REUTERS","U.S. would welcome Modi as India leader despite past visa ban","2014-05-13T00:46:23.0"
"http://rt.com/op-edge/158528-russia-response-ukraine-donetsk/","RT","Moscow not in rush to respond Donetsk People's Republic’s plea of accession","2014-05-13T01:36:15.0"
"http://feeds.reuters.com/~r/Reuters/worldNews/~3/pSvF5Pl9zmc/story01.htm","REUTERS","Mexico readying legal defense in sugar dispute with U.S.","2014-05-13T01:56:42.0"
"http://en.itar-tass.com/russia/731336?utm_medium=rss20","TASS","Foreign Minister: Russia finds sanctions against highly regrettable and unworthy of EU","2014-05-13T01:13:01.0"
"http://rt.com/news/158536-russia-disappointed-eu-sanctions/","RT","Russia disappointed over additional EU sanctions","2014-05-13T03:33:51.0"
"http://en.itar-tass.com/russia/731338?utm_medium=rss20","TASS","Canada extends list of Russians falling under sanctions over Ukraine","2014-05-13T03:02:10.0"
"http://rt.com/op-edge/158532-russia-ignore-cold-war/","RT","Russia should ignore Washington's 'new Cold War'","2014-05-13T04:05:18.0"
"http://news.xinhuanet.com/english/world/2014-05/12/c_133328798.htm","XINHUA","<a href='http://news.xinhuanet.com/english/world/2014-05/12/c_133328798.htm' target='_blank'>EU calls referendum in eastern Ukraine illegitimate</a>","2014-05-13T02:00:00.0"
"http://en.itar-tass.com/world/731340?utm_medium=rss20","TASS","EU expands blacklist to include more Russian, Ukrainian individuals, companies","2014-05-13T06:29:27.0"
"http://edition.cnn.com/video/data/2.0/video/world/2014/05/12/lok-foster-ukraine-voting-cnn-polling.cnn.html?eref=edition","CNN","Most back sanctions","2014-05-13T06:28:11.0"
"http://en.itar-tass.com/world/731345?utm_medium=rss20","TASS","Russia takes seriously fulfilment of WTO commitments — ministry official","2014-05-13T07:01:21.0"
"http://en.itar-tass.com/economy/731347?utm_medium=rss20","TASS","Russia’s Central Bank shuts down another Moscow bank for illegal transactions","2014-05-13T07:32:46.0"
"http://feeds.reuters.com/~r/Reuters/worldNews/~3/-80B1MAtWtc/story01.htm","REUTERS","Rebels appeal to join Russia after east Ukraine referendum","2014-05-13T10:04:41.0"
"http://en.ria.ru/world/20140513/189785917/OPINION-US-Sent-CIA-Director-to-Kiev-to-Initiate-Crackdown-on.html","RIA","OPINION: US Sent CIA Director to Kiev to Initiate Crackdown on Protesters","2014-05-13T09:31:00.0"
"http://en.ria.ru/russia/20140513/189785830/Russian-Foreign-Ministry-Brands-New-EU-Sanctions-Irresponsible.html","RIA","Russian Foreign Ministry Brands New EU Sanctions ‘Irresponsible’","2014-05-13T09:01:54.0"
"http://en.ria.ru/world/20140513/189785537/OPINION-US-Using-CIA-Intel-Operatives-to-Support-Ukraine-Coup.html","RIA","OPINION: US Using CIA Intel Operatives to Support Ukraine Coup Gov’t","2014-05-13T08:53:16.0"
"http://en.ria.ru/world/20140513/189785273/OPINION-China-Fears-US-Russia-War-of-Nerves.html","RIA","OPINION: China Fears US-Russia 'War of Nerves'","2014-05-13T08:43:32.0"
"http://en.ria.ru/world/20140513/189785064/REVIEW-European-Commission-Should-Advise-Ukraine-to-Pay-Gas-Debt.html","RIA","REVIEW: European Commission Should Advise Ukraine to Pay Gas Debt to Russia","2014-05-13T08:38:10.0"
"http://en.itar-tass.com/world/731372?utm_medium=rss20","TASS","Turchynov: Ukrainian security forces continue operation in Donetsk and Luhansk","2014-05-13T10:34:22.0"
"http://en.itar-tass.com/world/731369?utm_medium=rss20","TASS","EU sanctions not helping in settlement of Ukrainian conflict — lawmaker","2014-05-13T10:30:11.0"
"http://en.itar-tass.com/russia/731366?utm_medium=rss20","TASS","Putin to visit China for talks with president, CICA summit May 20-21","2014-05-13T10:11:25.0"
"http://en.itar-tass.com/world/731351?utm_medium=rss20","TASS","Ukrainians should settle domestic affairs themselves - Chinese diplomat","2014-05-13T09:46:36.0"
"http://en.itar-tass.com/world/731350?utm_medium=rss20","TASS","US and EU may ban export of energy equipment to Russia","2014-05-13T08:47:39.0"
"http://en.itar-tass.com/world/731349?utm_medium=rss20","TASS","US deploys surveillance aircraft over Nigeria in search for kidnapped schoolchildren","2014-05-13T08:25:26.0"
"http://rt.com/business/158592-gazprombank-transfer-sanctions-europe/","RT","Russia’s third largest bank moves money from Europe to Moscow for safe keeping","2014-05-13T11:02:39.0"
"http://rt.com/news/158588-australia-nsa-snowden-book/","RT","?Aussie intelligence requested US help to spy on own citizens","2014-05-13T10:59:36.0"
"http://en.ria.ru/russia/20140513/189788319/Putin-to-Visit-China-Next-Week-for-Trade-Energy-Deals--Kremlin.html","RIA","Putin to Visit China Next Week for Trade, Energy Deals – Kremlin","2014-05-13T11:03:00.0"
"http://en.ria.ru/world/20140513/189788166/ANALYSIS-China-Russia-US-Bering-Strait-Railroad-Plan-Feasible.html","RIA","ANALYSIS: China-Russia-US Bering Strait Railroad Plan ‘Feasible’","2014-05-13T10:59:00.0"
"http://en.ria.ru/world/20140513/189787940/OPINION-US-EU-Predictably-Refuse-to-Accept-Ukraine-Referendums.html","RIA","OPINION: US, EU Predictably Refuse to Accept Ukraine Referendums","2014-05-13T10:47:00.0"
