"Url","Source","Title","Published"
"http://rt.com/news/155572-ryabkov-ukraine-south-crimea/","RT","Russia won t repeat Crimea scenario in southeastern Ukraine - Russian Deputy FM","Tue- 29 Apr 2014 08-52-45 +0000"
"http://rt.com/news/155520-slavyansk-taxi-driver-soldiers/","RT"," Who are you defending Taxi driver stands up to Ukrainian soldiers VIDEO ","Tue- 29 Apr 2014 04-37-14 +0000"
"http://rt.com/news/155504-uk-france-baltic-jets/","RT","Britain France deploy 8 fighter jets to Lithuania and Poland","Tue- 29 Apr 2014 01-25-01 +0000"
"http://rt.com/business/155536-japan-imposes-sanctions-russia/","RT","â€‹New Japanese sanctions 23 visas denied","Tue- 29 Apr 2014 11-08-12 +0000"
"http://rt.com/news/155620-eu-japan-sanctions-russia/","RT","EU â€?should be ashamedâ€™ after sanctions on Russia - Moscow","Tue- 29 Apr 2014 12-06-28 +0000"
"http://rt.com/op-edge/155296-india-crimea-ukraine-integrity/","RT","India supports Russia over Crimea but stresses Ukraine integrity","Tue- 29 Apr 2014 12-35-20 +0000"
"http://rt.com/news/155640-protesters-government-building-ukraine/","RT","Anti-Kiev protesters take control of govt building in Lugansk Region east Ukraine","Tue- 29 Apr 2014 12-26-54 +0000"
"http://rt.com/op-edge/155616-ukraine-geneva-meeting-de-escalation/","RT","Ukraine What de-escalation means","Tue- 29 Apr 2014 12-39-34 +0000"
"http://rt.com/news/155704-lugansk-protesters-interior-hq/","RT","Hundreds surround Int. Ministry HQ in Lugansk demand police surrender","Tue- 29 Apr 2014 16-33-09 +0000"
"http://rt.com/news/155732-putin-usa-behind-ukraine-crisis/","RT","Putin Washington behind Ukraine events all along though flying low","Tue- 29 Apr 2014 19-26-21 +0000"
"http://www.aljazeera.com/news/europe/2014/05/pro-russia-rebels-make-more-gains-donetsk-201451144122676599.html","AJ","Pro-Russia rebels make more gains in Donetsk","Thu- 01 May 2014 21-18-55 GMT"
"http://www.aljazeera.com/news/africa/2014/05/kerry-south-sudan-push-halt-conflict-201452102013554800.html","AJ","Kerry in South Sudan in push to halt conflict","Fri- 02 May 2014 11-41-23 GMT"
"http://www.aljazeera.com/news/asia-pacific/2014/04/us-philippines-sign-ten-year-defence-pact-201442861348477236.html","AJ","Philippines defence pact boosts US influence","Mon- 28 Apr 2014 10-07-14 GMT"
"http://www.aljazeera.com/news/europe/2014/04/ukraine-separatists-parade-seized-observers-201442713230582461.html","AJ","Ukraine separatists parade seized observers","Sun- 27 Apr 2014 16-37-46 GMT"
"http://www.aljazeera.com/news/europe/2014/04/us-slaps-more-sanctions-putin-aides-201442815525107393.html","AJ","New US sanctions target Putin aides","Mon- 28 Apr 2014 15-30-54 GMT"
"http://www.aljazeera.com/news/europe/2014/04/ukraine-forces-move-rebel-stronghold-2014424103616907958.html","AJ","Ukraine forces move in on rebel stronghold","Thu- 24 Apr 2014 14-25-37 GMT"
"http://www.aljazeera.com/news/europe/2014/04/ukraine-helpless-quell-unrest-201443013278990159.html","AJ","Ukraine helpless to quell unrest","Wed- 30 Apr 2014 15-15-27 GMT"
"http://www.aljazeera.com/news/europe/2014/04/ukraine-gets-17bn-imf-aid-package-201443021483033270.html","AJ","Ukraine gets 17bn IMF aid package","Wed- 30 Apr 2014 22-52-39 GMT"
"http://www.aljazeera.com/news/europe/2014/05/ukraine-minister-russia-planning-invasion-20145191420109441.html","AJ","Ukraine minister Russia planning invasion","Thu- 01 May 2014 11-02-05 GMT"
"http://www.aljazeera.com/news/europe/2014/04/russia-eu-should-be-ashamed-over-sanctions-2014429103145976694.html","AJ","Russia EU should be ashamed over sanctions","Tue- 29 Apr 2014 11-57-40 GMT"
"http://www.aljazeera.com/news/africa/2014/04/un-lifts-ban-ivory-coast-diamonds-2014429163630221689.html","AJ","UN lifts ban on Ivory Coast diamonds","Tue- 29 Apr 2014 17-19-11 GMT"
"http://en.itar-tass.com/world/730196?utm_medium=rss20","TASS","Donetsk Republic co-chair says law enforcers can be swapped for militiamen","Fri- 02 May 2014 00-10-16 +0400"
"http://en.itar-tass.com/russia/730192?utm_medium=rss20","TASS","One dies in mine cave-in in Yakutia","Thu- 01 May 2014 22-28-40 +0400"
"http://en.itar-tass.com/economy/730184?utm_medium=rss20","TASS","VimpelCom delays filing of Annual Report to SEC due to Uzbekistan probe","Thu- 01 May 2014 19-19-58 +0400"
"http://en.itar-tass.com/russia/730167?utm_medium=rss20","TASS","Russiaâ€™s unemployment rate downs to 5.4% in March vs. February","Thu- 01 May 2014 16-43-44 +0400"
"http://en.itar-tass.com/russia/730164?utm_medium=rss20","TASS","Putin against early introduction of electricity social consumption norms","Thu- 01 May 2014 15-42-11 +0400"
"http://en.itar-tass.com/economy/730160?utm_medium=rss20","TASS","Russiaâ€™s YoY retail gasoline prices grow 5.4%","Thu- 01 May 2014 15-37-11 +0400"
"http://en.itar-tass.com/world/730151?utm_medium=rss20","TASS","Peru interested in closer contacts with Customs Union â€” Lavrov","Thu- 01 May 2014 11-02-37 +0400"
"http://en.itar-tass.com/russia/730143?utm_medium=rss20","TASS","Russia Peru foreign ministers discuss military technology co-operation","Thu- 01 May 2014 09-51-32 +0400"
"http://en.itar-tass.com/world/730109?utm_medium=rss20","TASS","Next OSCE anti-terrorism conference may be held in Belgrade in 2015","Wed- 30 Apr 2014 20-44-28 +0400"
"http://en.itar-tass.com/world/730092?utm_medium=rss20","TASS","OSCE military observers held in Sloviansk unlikely to be released soon","Wed- 30 Apr 2014 19-00-49 +0400"
"http://en.itar-tass.com/economy/730087?utm_medium=rss20","TASS","Rosneft to invest almost 12 billion in gas projects until 2018","Wed- 30 Apr 2014 18-28-35 +0400"
"http://en.itar-tass.com/economy/730082?utm_medium=rss20","TASS","Ukraineâ€™s overall debt for Russian gas grows to 3.492 billion","Wed- 30 Apr 2014 17-22-17 +0400"
"http://en.itar-tass.com/economy/730057?utm_medium=rss20","TASS","IMF expects Russia budget surplus to make 0.3%","Wed- 30 Apr 2014 15-55-47 +0400"
"http://en.itar-tass.com/economy/730246?utm_medium=rss20","TASS","Russiaâ€™s Aeroflot to increase number of flights to Simferopol","Fri- 02 May 2014 16-41-09 +0400"
"http://en.itar-tass.com/world/730247?utm_medium=rss20","TASS","Western countries first get on line with OSCE observers detained in Ukraine","Fri- 02 May 2014 16-55-57 +0400"
"http://en.itar-tass.com/world/730268?utm_medium=rss20","TASS","Medvedev urges Kiev authorities to stop killing their citizens","Fri- 02 May 2014 19-33-11 +0400"
"http://en.itar-tass.com/russia/730269?utm_medium=rss20","TASS","Russiaâ€™s Aeroflot to increase number of flights to Simferopol","Fri- 02 May 2014 19-49-33 +0400"
"http://en.itar-tass.com/world/729805?utm_medium=rss20","TASS","Anti-Russian sanctions to badly hit German economy â€” expert","Mon- 28 Apr 2014 13-59-51 +0400"
"http://en.itar-tass.com/world/729803?utm_medium=rss20","TASS","Turchynov signs bill declaring Crimea occupied territory ","Mon- 28 Apr 2014 13-26-38 +0400"
"http://en.itar-tass.com/russia/729795?utm_medium=rss20","TASS","Russian government to provide subsidies for organizing transportation to from Crimea","Mon- 28 Apr 2014 12-55-27 +0400"
"http://en.itar-tass.com/world/729801?utm_medium=rss20","TASS","USA to announce further sanctions vs. Russia later on Monday","Mon- 28 Apr 2014 12-48-13 +0400"
"http://en.itar-tass.com/world/729796?utm_medium=rss20","TASS","Ukrainian Interior Ministry opens criminal case over clash in Kharkiv","Mon- 28 Apr 2014 12-43-42 +0400"
"http://en.itar-tass.com/russia/729781?utm_medium=rss20","TASS","Lavrov praises South Africaâ€™s constructive position on Ukraine crisis","Mon- 28 Apr 2014 10-32-35 +0400"
"http://en.itar-tass.com/world/729759?utm_medium=rss20","TASS","German politician says dispatching of Germany military observers to Ukraine silly action","Mon- 28 Apr 2014 07-58-51 +0400"
"http://en.itar-tass.com/economy/729769?utm_medium=rss20","TASS","RF govt to review implementation of state programmes","Mon- 28 Apr 2014 04-56-04 +0400"
"http://en.itar-tass.com/russia/729767?utm_medium=rss20","TASS","Putin to meet lawmakers in Petrozavodsk to discuss integration of Crimea and Sevastopol","Mon- 28 Apr 2014 03-27-08 +0400"
"http://en.itar-tass.com/world/729762?utm_medium=rss20","TASS","US planning new sanctions against Russia says White House aide","Mon- 28 Apr 2014 00-42-23 +0400"
"http://en.itar-tass.com/world/729750?utm_medium=rss20","TASS","Neo-Nazis holding action in Lvov to commemorate Ukrainian SS division","Sun- 27 Apr 2014 22-37-35 +0400"
"http://en.itar-tass.com/world/729754?utm_medium=rss20","TASS","Presidential candidate Poroshenko pledges Ukraine will stop buying Russian gas from 2015","Sun- 27 Apr 2014 21-49-54 +0400"
"http://en.itar-tass.com/world/729749?utm_medium=rss20","TASS","Leader of Bulgarian Socialist Party there are no grounds for sanctions against Russia","Sun- 27 Apr 2014 21-23-59 +0400"
"http://en.itar-tass.com/russia/729748?utm_medium=rss20","TASS","Crimean authorities begin to de-mothball water well in northeastern areas","Sun- 27 Apr 2014 20-57-29 +0400"
"http://en.itar-tass.com/world/729747?utm_medium=rss20","TASS","OSCE refutes Ukrainian foreign ministerâ€™s allegations about secr-genâ€™s visit to Kiev","Sun- 27 Apr 2014 19-50-02 +0400"
"http://en.itar-tass.com/russia/729744?utm_medium=rss20","TASS","Bomb threat call at Mosfilm film studio proves to be hoax","Sun- 27 Apr 2014 19-17-33 +0400"
"http://en.itar-tass.com/world/729743?utm_medium=rss20","TASS","Kiev city authorities cancel Victory Day parade in Kiev on May 9","Sun- 27 Apr 2014 19-11-02 +0400"
"http://en.itar-tass.com/world/729742?utm_medium=rss20","TASS","OSCE secretary general to arrive in Kiev late on Sunday","Sun- 27 Apr 2014 18-48-57 +0400"
"http://en.itar-tass.com/world/729737?utm_medium=rss20","TASS","Former deputies in western Ukraine speak out against march commemorating SS division","Sun- 27 Apr 2014 17-49-56 +0400"
"http://en.itar-tass.com/russia/729735?utm_medium=rss20","TASS","Moscowâ€™s police checking bomb warning call at Mosfilm film studio","Sun- 27 Apr 2014 17-47-11 +0400"
"http://en.itar-tass.com/russia/729734?utm_medium=rss20","TASS","Russia to continue efforts to have arrested Donetsk governor released as soon as possible","Sun- 27 Apr 2014 17-28-29 +0400"
"http://en.itar-tass.com/russia/729732?utm_medium=rss20","TASS","Putin to discuss integration of Crimea Sevastopol in Russia with lawmakers","Sun- 27 Apr 2014 17-26-31 +0400"
"http://en.itar-tass.com/world/729731?utm_medium=rss20","TASS","Five candidates for Kiev mayor registered with territorial election comission","Sun- 27 Apr 2014 17-25-46 +0400"
"http://en.itar-tass.com/russia/729730?utm_medium=rss20","TASS","Medvedev to meet with Crown Prince of Bahrain on April 29","Sun- 27 Apr 2014 17-24-53 +0400"
"http://en.itar-tass.com/world/729728?utm_medium=rss20","TASS","Ukraine federalisation supporters protesting in 2 big east Ukrainian cities","Sun- 27 Apr 2014 16-02-51 +0400"
"http://en.itar-tass.com/russia/729723?utm_medium=rss20","TASS","Russia celebrates Day of Russian Parliamentarism","Sun- 27 Apr 2014 13-46-41 +0400"
"http://en.itar-tass.com/world/729722?utm_medium=rss20","TASS","Locals barricade administrative building to protect native east Ukraine city","Sun- 27 Apr 2014 11-52-24 +0400"
"http://en.itar-tass.com/world/729714?utm_medium=rss20","TASS","Peopleâ€™s militia fighters in Donetsk region capture three special task force officers","Sun- 27 Apr 2014 08-48-21 +0400"
"http://en.itar-tass.com/russia/729713?utm_medium=rss20","TASS","In Ukrainian crisis conditions Switzerland gives constructive dialogue example - official","Sun- 27 Apr 2014 07-46-52 +0400"
"http://en.itar-tass.com/russia/729709?utm_medium=rss20","TASS","Gunmen cache with more than tonne of food found in Ingushetia","Sun- 27 Apr 2014 06-19-20 +0400"
"http://en.itar-tass.com/russia/729706?utm_medium=rss20","TASS","Duma to consider in autumn amendments to law on retailers cost saving","Sun- 27 Apr 2014 04-01-31 +0400"
"http://en.itar-tass.com/world/729697?utm_medium=rss20","TASS","Kiev has no legal grounds for halting water supply to Crimea - deputy premier","Sat- 26 Apr 2014 22-56-35 +0400"
"http://en.itar-tass.com/world/729696?utm_medium=rss20","TASS","Ukrainian FM invites Russia to hold talks in Vienna April 28","Sat- 26 Apr 2014 22-55-01 +0400"
"http://en.itar-tass.com/russia/729695?utm_medium=rss20","TASS","New sanctions against Russia can upset crisis resolution in Ukraine -official","Sat- 26 Apr 2014 22-40-35 +0400"
"http://en.itar-tass.com/world/729693?utm_medium=rss20","TASS","Timoshenko says Ukraine should join NATO","Sat- 26 Apr 2014 21-45-13 +0400"
"http://en.itar-tass.com/russia/729692?utm_medium=rss20","TASS","Lavrov urges OSCE to press for speedy release of political prisoners in Ukraine","Sat- 26 Apr 2014 21-08-23 +0400"
"http://en.itar-tass.com/russia/729690?utm_medium=rss20","TASS","Lavrov Kerry state 92 prc of chemicals removed from Syria","Sat- 26 Apr 2014 20-50-25 +0400"
"http://en.itar-tass.com/russia/729687?utm_medium=rss20","TASS","Lavrov calls for end to army operation against protesters in Ukraine","Sat- 26 Apr 2014 20-07-27 +0400"
"http://en.itar-tass.com/world/729684?utm_medium=rss20","TASS","ICRC OSCE Kiev agree on visit to jailed Donetsk peopleâ€™s governor","Sat- 26 Apr 2014 19-36-48 +0400"
"http://en.itar-tass.com/world/729679?utm_medium=rss20","TASS","Presidential candidate situation in Ukraine can be settled in 2 days","Sat- 26 Apr 2014 19-14-00 +0400"
"http://en.itar-tass.com/russia/729673?utm_medium=rss20","TASS","No violation of Ukraine air space by Russian aircraft","Sat- 26 Apr 2014 17-32-47 +0400"
"http://en.itar-tass.com/russia/729671?utm_medium=rss20","TASS","Russian and German foreign ministers had discussed the crisis in Ukraine","Sat- 26 Apr 2014 16-40-54 +0400"
"http://en.itar-tass.com/russia/729668?utm_medium=rss20","TASS","RF was taking steps to settle situation over detention of military inspectors in Slavyansk","Sat- 26 Apr 2014 15-48-12 +0400"
"http://en.itar-tass.com/russia/729664?utm_medium=rss20","TASS","Russia to take all steps to free detained OSCE observers","Sat- 26 Apr 2014 13-21-57 +0400"
"http://en.itar-tass.com/russia/729661?utm_medium=rss20","TASS","Snowstorm hits Chelyabinsk reg leaving thousands without electricity","Sat- 26 Apr 2014 09-58-34 +0400"
"http://en.itar-tass.com/world/729808?utm_medium=rss20","TASS","Beijing says sanctions against Russia unlikely to help resolve Ukraineâ€™s problems","Mon- 28 Apr 2014 14-15-47 +0400"
"http://en.itar-tass.com/russia/729813?utm_medium=rss20","TASS","Russian and German diplomats discuss detention of OSCE military observers in Ukraine","Mon- 28 Apr 2014 15-21-33 +0400"
"http://en.itar-tass.com/economy/729826?utm_medium=rss20","TASS","EU signs 1 billion euro 13 billion memorandum in aid for Ukraine","Mon- 28 Apr 2014 16-13-44 +0400"
"http://en.itar-tass.com/world/729827?utm_medium=rss20","TASS","No reasons to use the 2011 Vienna document over Russiaâ€™s military exercises in Ukraine","Mon- 28 Apr 2014 17-24-46 +0400"
"http://en.itar-tass.com/russia/729830?utm_medium=rss20","TASS","Russia ready to welcome Ukraineâ€™s defense sector specialists â€” Putin","Mon- 28 Apr 2014 17-24-45 +0400"
"http://en.itar-tass.com/world/729837?utm_medium=rss20","TASS","USA announces new sanctions against Russia","Mon- 28 Apr 2014 17-23-14 +0400"
"http://en.itar-tass.com/world/729832?utm_medium=rss20","TASS","Ukraine should launch dialogue with Russia â€” presidential candidate","Mon- 28 Apr 2014 17-32-22 +0400"
"http://en.itar-tass.com/economy/729834?utm_medium=rss20","TASS","Slovakia agrees on gas reverse supplies to Ukraine","Mon- 28 Apr 2014 17-47-06 +0400"
"http://en.itar-tass.com/russia/729833?utm_medium=rss20","TASS","Military observers detained German Russian foreign ministers assess Ukraine seizure ","Mon- 28 Apr 2014 17-41-59 +0400"
"http://en.itar-tass.com/world/729842?utm_medium=rss20","TASS","Gunman aimed to kill Kharkiv mayor â€” presidential candidate","Mon- 28 Apr 2014 18-34-58 +0400"
"http://en.itar-tass.com/russia/729848?utm_medium=rss20","TASS","Moscow urges international community to condemn human rights violations in Ukraine","Mon- 28 Apr 2014 18-55-20 +0400"
"http://en.itar-tass.com/world/729846?utm_medium=rss20","TASS","Protesters in Luhansk region name condition for vacating Security Service building","Mon- 28 Apr 2014 18-52-49 +0400"
"http://en.itar-tass.com/russia/729854?utm_medium=rss20","TASS","Water supply problem in Crimea to cost 247- 417 million - Kremlin aide","Mon- 28 Apr 2014 20-14-03 +0400"
"http://en.itar-tass.com/economy/729851?utm_medium=rss20","TASS","Belarus to cut export duties of oil petroleum products to Russiaâ€™s level from May 1","Mon- 28 Apr 2014 19-55-32 +0400"
"http://en.itar-tass.com/russia/729855?utm_medium=rss20","TASS","Russiaâ€™s Foreign Minister Crown Prince of Bahrain discuss Ukraine situation","Mon- 28 Apr 2014 20-30-14 +0400"
"http://en.itar-tass.com/world/729858?utm_medium=rss20","TASS","New sanctions against Russia not to help solve Ukrainian crisis","Mon- 28 Apr 2014 20-57-18 +0400"
"http://en.itar-tass.com/world/729859?utm_medium=rss20","TASS","Western sanctions against Russia not to affect rouble economy - Kremlin aide","Mon- 28 Apr 2014 21-13-08 +0400"
"http://en.itar-tass.com/russia/729869?utm_medium=rss20","TASS","FM Westâ€™s accusations of Russiaâ€™s noncompliance with Geneva agreement unfounded","Mon- 28 Apr 2014 23-24-02 +0400"
"http://en.itar-tass.com/world/729862?utm_medium=rss20","TASS","US unilateral sanctions against Russia unlawful","Mon- 28 Apr 2014 21-50-31 +0400"
"http://en.itar-tass.com/russia/729875?utm_medium=rss20","TASS","Shoigu denies Russian sabotage-reconnaissance groups operate in Ukraine","Mon- 28 Apr 2014 23-41-47 +0400"
"http://en.itar-tass.com/economy/729865?utm_medium=rss20","TASS","Ukraine ready to pay debt to Gazprom at 268","Tue- 29 Apr 2014 00-08-18 +0400"
"http://en.itar-tass.com/russia/729876?utm_medium=rss20","TASS","Lavrov to visit Nicaragua April 29 for talks with Ortega","Tue- 29 Apr 2014 00-19-06 +0400"
"http://en.itar-tass.com/world/729872?utm_medium=rss20","TASS","Donetsk region proposes nationwide referendum on regionsâ€™ powers May 25","Tue- 29 Apr 2014 00-15-02 +0400"
"http://en.itar-tass.com/world/729871?utm_medium=rss20","TASS","Ukrainian radicals attack peaceful antifascist procession in Donetsk","Tue- 29 Apr 2014 00-13-18 +0400"
"http://en.itar-tass.com/economy/729868?utm_medium=rss20","TASS","Russian manufacturer of heavy-duty trucks sells Ukrainian segment of business to partner","Tue- 29 Apr 2014 00-10-57 +0400"
"http://en.itar-tass.com/economy/729864?utm_medium=rss20","TASS","Bahrain has no plans to buy Russiaâ€™s SuperJet-100 liner","Tue- 29 Apr 2014 01-08-31 +0400"
"http://en.itar-tass.com/economy/729655?utm_medium=rss20","TASS","MasterCard to estimate effects of Russiaâ€™s own future payment system","Sat- 26 Apr 2014 03-57-55 +0400"
"http://en.itar-tass.com/russia/729654?utm_medium=rss20","TASS","Russian diplomat detentions of journalists in Ukraine abuse freedom of speech","Sat- 26 Apr 2014 02-49-22 +0400"
"http://en.itar-tass.com/world/729651?utm_medium=rss20","TASS","Kiev authorities Russia should dissociate itself from protesters in southeastern regions","Sat- 26 Apr 2014 00-36-43 +0400"
"http://en.itar-tass.com/world/729647?utm_medium=rss20","TASS","Ukrainian troops destroy check point of federalization supporters near Slavyansk","Fri- 25 Apr 2014 23-50-35 +0400"
"http://en.itar-tass.com/world/729638?utm_medium=rss20","TASS","Kiev afraid Ukraineâ€™s center and west may arise along with southeast â€” president nominee","Fri- 25 Apr 2014 21-01-21 +0400"
"http://en.itar-tass.com/russia/729635?utm_medium=rss20","TASS","Russia urges to immediately stop combat operations in Ukraine","Fri- 25 Apr 2014 20-43-50 +0400"
"http://en.itar-tass.com/world/729637?utm_medium=rss20","TASS","USA declares readiness to impose targeted sanctions against Russia","Fri- 25 Apr 2014 20-19-12 +0400"
"http://en.itar-tass.com/world/729634?utm_medium=rss20","TASS","Russia Lebanon cooperating in oil and gas sector â€” Lebanese foreign minister","Fri- 25 Apr 2014 20-00-50 +0400"
"http://en.itar-tass.com/economy/729633?utm_medium=rss20","TASS","External circumstances must prompt Russia to use ruble in foreign trade â€” 1st deputy PM","Fri- 25 Apr 2014 19-55-04 +0400"
"http://en.itar-tass.com/world/729628?utm_medium=rss20","TASS","US UK Germany Italy and France leaders call for new sanctions against Russia","Fri- 25 Apr 2014 18-52-48 +0400"
"http://en.itar-tass.com/economy/729619?utm_medium=rss20","TASS","No politics behind bans on food imports","Fri- 25 Apr 2014 17-53-34 +0400"
"http://en.itar-tass.com/world/729608?utm_medium=rss20","TASS","Eurasian Economic Council not to invite observers to its Minsk session","Fri- 25 Apr 2014 16-00-16 +0400"
"http://en.itar-tass.com/russia/729590?utm_medium=rss20","TASS","No word from US on defence chief phone talk with Russiaâ€™s Shoigu â€” ministry","Fri- 25 Apr 2014 14-54-48 +0400"
"http://en.itar-tass.com/economy/729591?utm_medium=rss20","TASS","Russia EU Ukraine may have gas talks soon â€” presidential aide","Fri- 25 Apr 2014 14-44-21 +0400"
"http://en.itar-tass.com/economy/729586?utm_medium=rss20","TASS","Russian inflation hits 7.2% year-on-year","Fri- 25 Apr 2014 14-34-11 +0400"
"http://en.itar-tass.com/russia/729559?utm_medium=rss20","TASS","Lavrov Russia to insist on respect to Geneva accord","Fri- 25 Apr 2014 11-59-49 +0400"
"http://en.itar-tass.com/economy/729550?utm_medium=rss20","TASS","Customs tariff on crude oil from Prirazlomny and Korchagin oil fields","Fri- 25 Apr 2014 11-01-05 +0400"
"http://en.itar-tass.com/russia/729544?utm_medium=rss20","TASS","Russia s decision on Crimea helped avoid casualties â€” Medvedev","Fri- 25 Apr 2014 09-40-36 +0400"
"http://en.itar-tass.com/world/729542?utm_medium=rss20","TASS","Russia not to face shortage of any food products because of sanctions â€” minister","Fri- 25 Apr 2014 09-23-35 +0400"
"http://en.itar-tass.com/economy/729433?utm_medium=rss20","TASS","Sanctions against Russia to affect French companies French commerce chief warns","Thu- 24 Apr 2014 18-30-00 +0400"
"http://en.itar-tass.com/world/729435?utm_medium=rss20","TASS","Eastern Ukrainian region demands withdrawal of Kiev troops","Thu- 24 Apr 2014 18-25-11 +0400"
"http://en.itar-tass.com/world/729432?utm_medium=rss20","TASS","Radicals behaviour in Ukraine poll run-up reinforces Russian doubt ","Thu- 24 Apr 2014 17-42-24 +0400"
"http://en.itar-tass.com/world/729429?utm_medium=rss20","TASS","Eastern Ukrainian region announces mobilization","Thu- 24 Apr 2014 17-25-26 +0400"
"http://en.itar-tass.com/russia/729428?utm_medium=rss20","TASS","Shoigu 11 000 servicemen involved in operation against civilians in Ukraineâ€™s southeast","Thu- 24 Apr 2014 17-11-02 +0400"
"http://en.itar-tass.com/economy/729423?utm_medium=rss20","TASS","Russian-Ukrainian trade volume down by 25%","Thu- 24 Apr 2014 17-01-50 +0400"
"http://en.itar-tass.com/economy/729406?utm_medium=rss20","TASS","Russia EC Ukraine meeting ahead for gas talks â€” EU envoy","Thu- 24 Apr 2014 16-21-29 +0400"
"http://en.itar-tass.com/world/729414?utm_medium=rss20","TASS","Putin Sanctions have several pluses for Russian economy","Thu- 24 Apr 2014 16-02-29 +0400"
"http://en.itar-tass.com/world/729408?utm_medium=rss20","TASS","Party of Regions Russian language must be recognized as second official","Thu- 24 Apr 2014 15-48-40 +0400"
"http://en.itar-tass.com/world/729392?utm_medium=rss20","TASS","Russian delegation not to participate in June PACE session - Russian lawmaker","Thu- 24 Apr 2014 15-25-22 +0400"
"http://en.itar-tass.com/russia/729402?utm_medium=rss20","TASS","Kiev authorities should make first step toward national reconciliation â€” Lavrov","Thu- 24 Apr 2014 15-17-25 +0400"
"http://en.itar-tass.com/world/729386?utm_medium=rss20","TASS","US EU former opposition to be blamed for Ukraine situation MP says","Thu- 24 Apr 2014 15-17-04 +0400"
"http://en.itar-tass.com/world/729375?utm_medium=rss20","TASS","East Ukraine s Sloviansk under attack one killed â€” media","Thu- 24 Apr 2014 13-54-40 +0400"
"http://en.itar-tass.com/russia/729371?utm_medium=rss20","TASS","Moscow hopes US will stop its far-fetched insinuations about Russia â€” Foreign Ministry","Thu- 24 Apr 2014 12-49-05 +0400"
"http://en.itar-tass.com/russia/729364?utm_medium=rss20","TASS","Crimea faces crop loss at 120 000 hectares due to water supply limiting by Kiev","Thu- 24 Apr 2014 12-42-30 +0400"
"http://en.itar-tass.com/world/729369?utm_medium=rss20","TASS","Awaiting Kiev s military operation situation in eastern regions of Ukraine","Thu- 24 Apr 2014 12-18-18 +0400"
"http://en.itar-tass.com/world/729357?utm_medium=rss20","TASS","Ukraine should not be field of geopolitical stand-off â€” Lavrov","Thu- 24 Apr 2014 10-45-32 +0400"
"http://en.itar-tass.com/world/729352?utm_medium=rss20","TASS","Donetsk activists seized by security service","Thu- 24 Apr 2014 10-14-08 +0400"
"http://en.itar-tass.com/world/729350?utm_medium=rss20","TASS","No instructions for retaliatory restrictions on Ukrainians to enter Russia â€” minister","Thu- 24 Apr 2014 09-44-28 +0400"
"http://en.itar-tass.com/russia/729349?utm_medium=rss20","TASS","1 800 tons of relief supplies delivered to Russiaâ€™s Crimea from regions","Thu- 24 Apr 2014 09-39-39 +0400"
"http://en.itar-tass.com/economy/729347?utm_medium=rss20","TASS","Russiaâ€™s Central Bank revokes license from Moscow National Bank of Business Development","Thu- 24 Apr 2014 09-27-47 +0400"
"http://en.itar-tass.com/economy/729341?utm_medium=rss20","TASS","Russiaâ€™s Central Bank revokes license from Moscow bank Mestny Kredit","Thu- 24 Apr 2014 08-52-20 +0400"
