"Url","Source","Title","Published"
"http://en.itar-tass.com/world/730282?utm_medium=rss20","TASS","Ukraine FM denies use of military hardware in special operation in eastern regions","2014-05-02T20:50:07.0"
"http://feeds.reuters.com/~r/Reuters/worldNews/~3/-R2jxd5ttfk/story01.htm","REUTERS","Ukraine crisis highlights NATO defense spending problem: Hagel","2014-05-02T21:09:09.0"
"http://edition.cnn.com/2014/05/02/health/indiana-mers/index.html?eref=edition","CNN","MERS virus spreads to U.S.","2014-05-02T21:19:22.0"
"http://en.itar-tass.com/russia/730286?utm_medium=rss20","TASS","Russia calls on UN to pass statement in support of Geneva accords on Ukrainian settlement","2014-05-02T21:42:32.0"
"http://rt.com/usa/156472-obama-merkel-nsa-dialogue/","RT","Germany not satisfied with US assurances over NSA spying","2014-05-02T22:13:51.0"
"http://edition.cnn.com/video/data/2.0/video/politics/2014/05/02/legal-view-obama-merkel-ukraine-statement.cnn.html?eref=edition","CNN","Obama, Merkel talk sanctions","2014-05-02T22:36:29.0"
"http://rt.com/news/156504-ukraine-east-clashes-military/","RT","Dozens reported injured or killed in Kramatorsk as Ukraine army launches assault","2014-05-02T22:05:05.0"
"http://feeds.reuters.com/~r/Reuters/worldNews/~3/aHr2goH1JPc/story01.htm","REUTERS","Obama, Merkel still struggle over spying but agree on trade","2014-05-02T22:40:51.0"
"http://en.itar-tass.com/world/730294?utm_medium=rss20","TASS","Ukrainian forces begin assault against Kramatorsk","2014-05-02T23:11:49.0"
"http://en.itar-tass.com/russia/730293?utm_medium=rss20","TASS","Kerry's refusal to discuss Ukraine is irresponsible approach","2014-05-02T22:50:51.0"
"http://rt.com/usa/156512-ron-paul-ukraine-war/","RT","?Ron Paul: Western powers fomenting Ukrainian conflict, US should ‘stay out’","2014-05-02T23:56:42.0"
"http://en.itar-tass.com/russia/730295?utm_medium=rss20","TASS","Moscow blames Kiev for tragic events in Odessa","2014-05-03T00:01:46.0"
"http://news.xinhuanet.com/english/world/2014-05/03/c_133305713.htm","XINHUA","<a href='http://news.xinhuanet.com/english/world/2014-05/03/c_133305713.htm' target='_blank'>Obama threatens broader sanctions on Russia</a>","2014-05-03T02:00:00.0"
"http://news.xinhuanet.com/english/world/2014-05/03/c_133305687.htm","XINHUA","<a href='http://news.xinhuanet.com/english/world/2014-05/03/c_133305687.htm' target='_blank'>Pentagon chief urges NATO members to raise defense spending amid Ukraine crisis</a>","2014-05-03T02:00:00.0"
"http://news.xinhuanet.com/english/world/2014-05/03/c_133305695.htm","XINHUA","<a href='http://news.xinhuanet.com/english/world/2014-05/03/c_133305695.htm' target='_blank'>Russia, Ukraine agree on normal gas transit until end of May</a>","2014-05-03T02:00:00.0"
"http://en.itar-tass.com/russia/730300?utm_medium=rss20","TASS","Moscow demands confirmation whether Russians were among Odessa victims","2014-05-03T02:36:53.0"
"http://rt.com/op-edge/156524-sleboda-ukraine-odessa-violence/","RT","Russia's warnings of inter-ethnic violence in Ukraine come to fruition","2014-05-03T03:37:15.0"
"http://edition.cnn.com/2014/05/03/world/europe/ukraine-crisis/index.html?eref=edition","CNN","Dozens killed across country as Ukraine crisis spirals","2014-05-03T11:00:08.0"
"http://edition.cnn.com/2014/04/29/world/europe/ukraine-lister-small-numbers/index.html?eref=edition","CNN","Ukraine crisis: Small numbers, global impact","2014-05-03T11:23:39.0"
"http://feeds.reuters.com/~r/Reuters/worldNews/~3/uGCumhF68MI/story01.htm","REUTERS","Dozens killed in Ukraine riot and fire; OSCE monitors freed","2014-05-03T12:09:12.0"
"http://feeds.reuters.com/~r/Reuters/worldNews/~3/YMn4DcmzgkA/story01.htm","REUTERS","Obama, Merkel still struggle over spying but agree on trade","2014-05-03T02:53:02.0"
"http://en.itar-tass.com/world/730317?utm_medium=rss20","TASS","Kremlin regrets approval of punitive operation is southeast of Ukraine - Putin spokesman","2014-05-03T10:47:36.0"
"http://en.itar-tass.com/world/730310?utm_medium=rss20","TASS","Ukraine acting interior minister claims operation in east not against country’s people","2014-05-03T08:56:52.0"
"http://en.itar-tass.com/russia/730304?utm_medium=rss20","TASS","RF shocked at West's placidity over actions against SE Ukraine people","2014-05-03T05:21:42.0"
"http://rt.com/news/156596-moscow-kiev-bloodshed-responsible/","RT","Kiev and western sponsors directly responsible for bloodshed in East Ukraine – Moscow","2014-05-03T10:21:31.0"
"http://en.itar-tass.com/world/730327?utm_medium=rss20","TASS","EU diplomats to discuss new sanctions against Russia May 5","2014-05-03T12:47:45.0"
"http://en.itar-tass.com/world/730330?utm_medium=rss20","TASS","Russia will not be able to persuade people in southeast of Ukraine to lay down arms","2014-05-03T13:39:37.0"
"http://rt.com/news/156548-west-reaction-ukraine-odessa/","RT","West reluctant to point finger at nationalist radicals in Ukraine crisis","2014-05-03T14:46:57.0"
"http://rt.com/news/156604-ukraine-southeast-crisis-diary/","RT","‘Why do they hate us so much?’ Southeastern Ukraine seeks to understand new regime","2014-05-03T14:31:56.0"
"http://edition.cnn.com/2014/04/30/opinion/iraq-election-gerges/index.html?eref=edition","CNN","Opinion: Iraq elections can't fix chaos","2014-05-03T14:26:46.0"
"http://en.itar-tass.com/russia/730335?utm_medium=rss20","TASS","Putin expresses deep condolences to families of Odessa fire victims - Kremlin spokesman","2014-05-03T14:57:47.0"
"http://en.itar-tass.com/world/730333?utm_medium=rss20","TASS","Events in southeast of Ukraine - crime against humanity","2014-05-03T15:29:47.0"
"http://en.itar-tass.com/russia/730340?utm_medium=rss20","TASS","Lavrov, OSCE Chairperson call for full compliance with Geneva Statement on Ukraine","2014-05-03T16:46:59.0"
"http://en.itar-tass.com/economy/730339?utm_medium=rss20","TASS","Ukraine can’t guarantee gas storage and transit to Europe - Russian minister","2014-05-03T16:37:16.0"
"http://rt.com/op-edge/156632-odessa-burnt-protesters-ukraine/","RT","A day that will live in infamy: The day Odessa citizens were savagely killed","2014-05-03T21:36:38.0"
"http://rt.com/news/156628-kramatorsk-residents-ukrainian-military/","RT","‘Fascists! Off to Kiev!’: Outraged Kramatorsk locals chase off Ukrainian military (VIDEO)","2014-05-03T21:09:22.0"
"http://feeds.reuters.com/~r/Reuters/worldNews/~3/tUXmBcNHs-U/story01.htm","REUTERS","Syria cannot delay removing chemical weapons: U.S.","2014-05-03T18:11:40.0"
"http://en.itar-tass.com/russia/730360?utm_medium=rss20","TASS","Duma demands tribunal for Kiev authorities for bloodbath in Odessa","2014-05-03T21:30:14.0"
"http://en.itar-tass.com/economy/730359?utm_medium=rss20","TASS","Russian minister: Ukraine has no right to revise gas price unilaterally","2014-05-03T20:43:05.0"
"http://en.itar-tass.com/world/730357?utm_medium=rss20","TASS","OSCE observers released in Slavyansk arrive in Kiev","2014-05-03T20:36:25.0"
"http://en.itar-tass.com/russia/730351?utm_medium=rss20","TASS","Lavrov says there is still chance of dialogue in Ukraine","2014-05-03T19:18:27.0"
"http://en.itar-tass.com/russia/730354?utm_medium=rss20","TASS","Peskov: events in Ukraine prove Russia’s position on Crimea right","2014-05-03T19:17:35.0"
"http://en.itar-tass.com/russia/730353?utm_medium=rss20","TASS","Russian FM: Kiev’s punitive operation in Slavyansk put OSCE observers’ lives at risk","2014-05-03T19:16:01.0"
"http://en.itar-tass.com/russia/730364?utm_medium=rss20","TASS","Putin expresses condolences to Afghan president over heavy landslide casualties","2014-05-03T22:12:41.0"
"http://feeds.washingtonpost.com/c/34656/f/636535/s/39e8e671/sc/38/l/0L0Swashingtonpost0N0Cblogs0Cworldviews0Cwp0C20A140C0A40C30A0Cshocking0Eimages0Eof0Ethe0Eworlds0Emost0Eforsaken0Epeople0Estarving0Eto0Edeath0C/story01.htm","WP","ï»¿Shocking images of the worldâ€™s most forsaken people starving to death","Wed- 30 Apr 2014 08-00-20 GMT"
"http://feeds.washingtonpost.com/c/34656/f/636535/s/39fef1b6/sc/8/l/0L0Swashingtonpost0N0Cblogs0Cworldviews0Cwp0C20A140C0A50C0A20Canother0Ejournalist0Eand0Etranslator0Ereport0Ebeing0Edetained0Ein0Eeastern0Eukraine0C/story01.htm","WP","Another journalist and translator report being detained in eastern Ukraine","Fri- 02 May 2014 15-52-26 GMT"
"http://feeds.washingtonpost.com/c/34656/f/636535/s/39ff86ee/sc/8/l/0L0Swashingtonpost0N0Cblogs0Cworldviews0Cwp0C20A140C0A50C0A20Camateur0Evideos0Eappear0Eto0Eshow0Eukrainian0Emilitary0Ehelicopter0Ebeing0Eshot0Edown0Eover0Eslovynask0C/story01.htm","WP","Videos appear to show Ukrainian military helicopter being shot down over Slovyansk","Fri- 02 May 2014 16-14-22 GMT"
"http://edition.cnn.com/2014/04/27/us/nba-team-owner-alleged-racist-remarks/index.html?eref=edition","CNN","Racist words attributed to NBA owner","Sun- 27 Apr 2014 14-59-19 EDT"
"http://edition.cnn.com/2014/04/27/world/europe/russia-ukraine-sanctions/index.html?eref=edition","CNN","New U.S. EU sanctions for Russia","Mon- 28 Apr 2014 05-58-56 EDT"
"http://edition.cnn.com/video/data/2.0/video/world/2014/04/28/pkg-paton-walsh-ukraine-osce-observers.cnn.html?eref=edition","CNN","Observers detained in Ukraine","Mon- 28 Apr 2014 02-36-21 EDT"
"http://edition.cnn.com/2014/04/23/world/europe/ukraine-crisis-five-scenarios/index.html?eref=edition","CNN","5 ways Ukraine crisis could end","Sat- 26 Apr 2014 04-55-56 EDT"
"http://edition.cnn.com/video/data/2.0/video/world/2014/04/25/ukraine-pro-russia-base-damon-pkg.cnn.html?eref=edition","CNN","Rare access to pro-Russia HQ","Sat- 26 Apr 2014 10-19-34 EDT"
"http://edition.cnn.com/video/data/2.0/video/world/2014/04/25/pkg-paton-walsh-explainer-ukraine-putin.cnn.html?eref=edition","CNN","What is Putin s interest in Ukraine ","Mon- 28 Apr 2014 05-21-14 EDT"
"http://edition.cnn.com/2014/04/28/world/europe/ukraine-crisis/index.html?eref=edition","CNN","Ukrainian mayor shot in back","Mon- 28 Apr 2014 06-59-25 EDT"
"http://edition.cnn.com/video/data/2.0/video/world/2014/04/28/pkg-paton-walsh-ukraine-rebel-routine.cnn.html?eref=edition","CNN","Soldier warns war is next","Mon- 28 Apr 2014 17-11-04 EDT"
"http://edition.cnn.com/2014/04/27/world/asia/malaysia-airlines-plane/index.html?eref=edition","CNN","Obama U.S. to keep aiding MH370 hunt","Sun- 27 Apr 2014 03-53-58 EDT"
"http://edition.cnn.com/video/data/2.0/video/international/2014/04/27/damon-pkg-living-on-edge-in-eastern-ukraine.cnn.html?eref=edition","CNN","Living on the edge in east Ukraine","Sat- 26 Apr 2014 23-06-05 EDT"
"http://edition.cnn.com/2014/03/07/business/russia-sanctions-why-the-u-s-and-europe-are-not-quite-in-step/index.html?eref=edition","CNN","Russia s trade ties preventing harsher sanctions ","Sun- 27 Apr 2014 06-29-31 EDT"
"http://edition.cnn.com/2014/04/27/world/europe/ukraine-crisis/index.html?eref=edition","CNN","Observers held in Ukraine as Obama slams Russia","Sun- 27 Apr 2014 09-37-22 EDT"
"http://edition.cnn.com/2014/04/23/opinion/motyl-putin-lavrov/index.html?eref=edition","CNN","Putin s strategy Good cop bad cop","Wed- 23 Apr 2014 09-08-13 EDT"
"http://edition.cnn.com/2014/04/24/world/europe/ukraine-gunmen-attack/index.html?eref=edition","CNN","Ukraine killings mark major escalation in crisis","Thu- 24 Apr 2014 10-11-45 EDT"
"http://edition.cnn.com/2014/04/23/world/europe/ukraine-crisis/index.html?eref=edition","CNN","U.S. troops enter Poland amid turmoil","Wed- 23 Apr 2014 23-50-10 EDT"
"http://edition.cnn.com/2014/04/23/world/europe/russian-bombers-intercepted/index.html?eref=edition","CNN","Dutch jets intercept Russian bombers","Wed- 23 Apr 2014 18-33-21 EDT"
"http://edition.cnn.com/2014/04/24/world/asia/obama-asia-visit/index.html?eref=edition","CNN","Obama stands by Japan s island claim","Thu- 24 Apr 2014 06-38-08 EDT"
"http://edition.cnn.com/2014/04/22/justice/texas-fbi-international-child-predator-victims/index.html?eref=edition","CNN","FBI seeks victims of global child molester","Wed- 23 Apr 2014 03-56-56 EDT"
"http://edition.cnn.com/2014/04/23/world/asia/obama-asia-visit/index.html?eref=edition","CNN","Obama s Asia tour","Thu- 24 Apr 2014 02-04-18 EDT"
"http://feeds.washingtonpost.com/c/34656/f/636535/s/39c375ac/sc/39/l/0L0Swashingtonpost0N0Cblogs0Cworldviews0Cwp0C20A140C0A40C250Ccold0Ewar0Econtinues0Eas0Eu0Es0Ekeeps0Ewartime0Ecommand0Eover0Es0Ekorean0Eforces0C/story01.htm","WP","Cold War continues as U.S. keeps wartime command over S. Korean forces","Fri- 25 Apr 2014 22-01-07 GMT"
"http://feeds.washingtonpost.com/c/34656/f/636535/s/39c15365/sc/1/l/0L0Swashingtonpost0N0Cblogs0Cworldviews0Cwp0C20A140C0A40C250Crussia0Ehijacks0Eu0Es0Estate0Edepartments0Eukraine0Ehashtag0C/story01.htm","WP","Russia hijacks U.S. State Departmentâ€™s Ukraine hashtag","Fri- 25 Apr 2014 16-42-16 GMT"
"http://feeds.washingtonpost.com/c/34656/f/636535/s/39c14b7d/sc/39/l/0L0Swashingtonpost0N0Cblogs0Cworldviews0Cwp0C20A140C0A40C250Cthe0Eshadow0Eover0Eobamas0Easia0Etrip0E30Eways0Echina0Escares0Ethe0Eu0Es0C/story01.htm","WP","The shadow over Obamaâ€™s Asia trip 3 ways China scares the U.S.","Fri- 25 Apr 2014 15-53-41 GMT"
"http://feeds.washingtonpost.com/c/34656/f/636535/s/39c0bdf9/sc/38/l/0L0Swashingtonpost0N0Cblogs0Cworldviews0Cwp0C20A140C0A40C250Cvladimir0Eputin0Ehates0Eeverything0Eabout0Ethe0Einternet0Eexcept0Ewebsite0Evladimir0C/story01.htm","WP","Vladimir Putin hates everything about the Internet except â€?Website Vladimirâ€™","Fri- 25 Apr 2014 13-59-42 GMT"
"http://feeds.washingtonpost.com/c/34656/f/636535/s/39b81225/sc/1/l/0L0Swashingtonpost0N0Cblogs0Cworldviews0Cwp0C20A140C0A40C240Cheres0Ewhat0Ereporters0Eare0Eseeing0Ein0Eslovyansk0C/story01.htm","WP","Hereâ€™s what reporters are seeing in Slovyansk","Thu- 24 Apr 2014 18-53-23 GMT"
"http://feeds.washingtonpost.com/c/34656/f/636535/s/39b77d2a/sc/13/l/0L0Swashingtonpost0N0Cblogs0Cworldviews0Cwp0C20A140C0A40C240Cthese0Eanti0Erussian0Eleaflets0Eare0Ebeing0Edropped0Efrom0Ehelicopters0Eover0Eeastern0Eukraine0C/story01.htm","WP","These anti-Russian leaflets are being dropped from helicopters over eastern Ukraine","Thu- 24 Apr 2014 18-25-54 GMT"
"http://feeds.washingtonpost.com/c/34656/f/636535/s/39ab8962/sc/1/l/0L0Swashingtonpost0N0Cblogs0Cworldviews0Cwp0C20A140C0A40C230Can0Eupdated0Eglossary0Ewith0Eeverything0Eyou0Eneed0Eto0Eknow0Eabout0Eukraines0Ecrisis0C/story01.htm","WP","An updated glossary with everything you need to know about Ukraineâ€™s crisis","Wed- 23 Apr 2014 15-34-35 GMT"
"http://feeds.washingtonpost.com/c/34656/f/636535/s/39a9e3da/sc/7/l/0L0Swashingtonpost0N0Cblogs0Cworldviews0Cwp0C20A140C0A40C230Cheres0Eputler0Ethe0Emash0Eup0Eimage0Eof0Eputin0Eand0Ehitler0Esweeping0Eukraine0C/story01.htm","WP","Hereâ€™s â€?Putler â€™ The mash-up image of Putin and Hitler sweeping Ukraine","Wed- 23 Apr 2014 13-16-28 GMT"
"http://feeds.washingtonpost.com/c/34656/f/636535/s/39d7c2ea/sc/8/l/0L0Swashingtonpost0N0Cblogs0Cworldviews0Cwp0C20A140C0A40C280Cviolence0Ebreaks0Eout0Eat0Epro0Eukraine0Erally0Eon0Edonetsk0C/story01.htm","WP","Violence breaks out at pro-Ukraine rally in Donetsk","Mon- 28 Apr 2014 16-28-48 GMT"
"http://feeds.washingtonpost.com/c/34656/f/636535/s/39d7c2ec/sc/13/l/0L0Swashingtonpost0N0Cblogs0Cworldviews0Cwp0C20A140C0A40C280Cthe0Emost0Eoffensive0Eowner0Ein0Eworld0Esports0Eis0Esadly0Enot0Edonald0Esterling0C/story01.htm","WP","The most offensive owner in world sports is sadly not Donald Sterling","Mon- 28 Apr 2014 16-27-49 GMT"
"http://feeds.washingtonpost.com/c/34656/f/636535/s/39d99e5c/sc/1/l/0L0Swashingtonpost0N0Cblogs0Cworldviews0Cwp0C20A140C0A40C280Ckharkivs0Emayor0Ehas0Ea0Ecolorful0Esocial0Emedia0Epresence0C/story01.htm","WP","Kharkivâ€™s mayor has a colorful social media presence","Mon- 28 Apr 2014 19-53-14 GMT"
"http://feeds.washingtonpost.com/c/34656/f/636535/s/3983970c/sc/7/l/0L0Swashingtonpost0N0Cblogs0Cworldviews0Cwp0C20A140C0A40C180Cunderstanding0Enovorossiya0Ethe0Elatest0Ehistorical0Econcept0Eto0Eget0Eworried0Eabout0Ein0Eukraine0C/story01.htm","WP","â€?Novorossiya â€™ the latest historical concept to worry about in Ukraine","Fri- 18 Apr 2014 16-22-07 GMT"
"http://feeds.washingtonpost.com/c/34656/f/636535/s/39daab7d/sc/1/l/0L0Swashingtonpost0N0Cblogs0Cworldviews0Cwp0C20A140C0A40C280Cu0Es0Ephilippines0Esecurity0Edeal0Eshows0Ethat0Eamerica0Estill0Ehas0Eits0Efans0C/story01.htm","WP","U.S.-Philippines security deal shows that America still has its fans","Mon- 28 Apr 2014 22-22-58 GMT"
"http://feeds.washingtonpost.com/c/34656/f/636535/s/39f4a8e4/sc/8/l/0L0Swashingtonpost0N0Cblogs0Cworldviews0Cwp0C20A140C0A50C0A10Cgetting0Eugly0Ehere0Ea0Epro0Erussian0Emob0Etries0Eto0Estorm0Eoffice0Ein0Edonetsk0C/story01.htm","WP","â€?Getting ugly hereâ€™ A pro-Russian mob tries to storm office in Donetsk","Thu- 01 May 2014 12-47-09 GMT"
"http://news.xinhuanet.com/english/world/2014-04/28/c_133295983.htm","XINHUA","U.S. not keen on putting up military bases in Philippines Obama","2014-04-28"
"http://news.xinhuanet.com/english/world/2014-04/26/c_133292199.htm","XINHUA","Putin Obama still in dialogue Kremlin","2014-04-26"
"http://news.xinhuanet.com/english/world/2014-04/26/c_133291972.htm","XINHUA","G7 leaders agree on new sanctions against Russia","2014-04-26"
"http://news.xinhuanet.com/english/world/2014-04/24/c_133286675.htm","XINHUA","U.S. Japan leaders vow to enhance bilateral ties","2014-04-24"
"http://news.xinhuanet.com/english/world/2014-04/24/c_126426397.htm","XINHUA","Putin highlights importance of culture for national unity","2014-04-24"
"http://rt.com/news/156248-russian-rocket-engines-pentagon/","RT","Pentagon says it cannot replace imported Russian rocket engines","Thu- 01 May 2014 21-25-09 +0000"
"http://rt.com/usa/156212-obama-biden-vacation-tab-40/","RT","Fighting income inequality Obama-Biden vacation tab reaches 40 mn","Thu- 01 May 2014 17-48-39 +0000"
"http://rt.com/news/156160-gas-rally-donetsk-ukraine/","RT","Tear gas in Ukraineâ€™s Donetsk as activists seize Prosecutorâ€™s Office PHOTOS ","Thu- 01 May 2014 12-36-51 +0000"
"http://rt.com/op-edge/156376-russia-bahrain-investment-deal-usa/","RT","â€?US in panic because of its waning powerâ€™","Fri- 02 May 2014 10-51-38 +0000"
"http://rt.com/usa/156284-wh-big-data-report-surveillance/","RT","White House concedes privacy protections lacking in big data report","Fri- 02 May 2014 03-44-18 +0000"
"http://rt.com/op-edge/156404-usa-russia-new-cold-war/","RT"," Cold War Against Russia â€” Without Debate ","Fri- 02 May 2014 11-45-12 +0000"
"http://rt.com/news/155320-kharkov-mayor-shot-ukraine/","RT","Mayor of Kharkov Ukraine shot in back hospitalized - press service","Mon- 28 Apr 2014 09-32-38 +0000"
"http://rt.com/op-edge/155300-gas-problems-ukraine-russia-eu/","RT","â€?Russia not obliged to finance Ukraine-EU integrationâ€™","Mon- 28 Apr 2014 09-19-00 +0000"
"http://rt.com/news/155224-ukraine-football-fans-clashes/","RT","Football ultras attack anti-govt protesters in eastern Ukraine VIDEO PHOTOS ","Sun- 27 Apr 2014 19-55-24 +0000"
"http://rt.com/news/155204-ukraine-protesters-tv-station/","RT","Anti-govt protesters seize TV station in eastern Ukraine call for own channel","Sun- 27 Apr 2014 15-52-13 +0000"
"http://rt.com/news/155200-mi5-hiring-russian-experts/","RT","MI5 hiring British Secret Service looking for intel experts on Russia","Sun- 27 Apr 2014 15-33-41 +0000"
"http://rt.com/news/155168-us-eu-sanctions-russia/","RT","US failing to push economic sanctions against Russia through EU allies","Sun- 27 Apr 2014 12-36-19 +0000"
"http://rt.com/news/155352-putin-ukraine-defense-industry/","RT","End of defense imports to Russia would be catastrophe for Ukraine â€“ Putin","Mon- 28 Apr 2014 11-56-29 +0000"
"http://rt.com/news/155316-obama-sanctions-putin-calculus/","RT","Obama says new sanctions to change Putinâ€™s calculus ","Mon- 28 Apr 2014 12-09-55 +0000"
"http://rt.com/op-edge/155348-us-administration-failure-ukraine/","RT"," Obama and Kerry fail to show leadership qualities required to settle Ukrainian issue ","Mon- 28 Apr 2014 12-33-26 +0000"
"http://rt.com/business/155272-ukraine-slovakia-reverse-gas/","RT","Ukraine strikes 3.2 bcm reverse gas flow deal with Slovakia","Mon- 28 Apr 2014 13-18-44 +0000"
"http://rt.com/op-edge/155356-afghanistan-elections-president-us-troops/","RT","â€?US came to Afghanistan with TV cash - they wonâ€™t let us goâ€™","Mon- 28 Apr 2014 13-30-22 +0000"
"http://rt.com/business/155404-russia-iran-energy-deal/","RT","â€‹Russia and Iran strike 10bn energy deal","Mon- 28 Apr 2014 14-48-48 +0000"
"http://rt.com/news/155364-ukraine-nazi-division-march/","RT","Neo-Nazis march in Lvov in honor of Ukrainian Waffen SS division PHOTOS VIDEO ","Mon- 28 Apr 2014 15-06-38 +0000"
"http://rt.com/news/155368-hitler-parallel-washington-post/","RT","Hitler parallel debate rages in Washington Post","Mon- 28 Apr 2014 15-24-11 +0000"
"http://rt.com/news/155424-donetsk-clashes-ukraine-protesters/","RT","Blasts fierce fighting in Donetsk between pro- and anti-Kiev demos VIDEO ","Mon- 28 Apr 2014 16-14-49 +0000"
"http://rt.com/usa/155420-obama-takes-selfie-malaysian-minister/","RT","Can t get enough Obama takes another selfie now with Malaysian PM","Mon- 28 Apr 2014 17-29-04 +0000"
"http://www.rt.com/news/155380-ukraine-protesters-barricade-buildings/","RT","Anti-Kiev protesters barricade City Hall in eastern Ukraine PHOTOS VIDEO ","Mon- 28 Apr 2014 17-48-49 +0000"
"http://rt.com/business/155312-rosneft-sechin-sanctions-us/","RT","Finance and energy industries not targeted by US sanctions","Mon- 28 Apr 2014 18-46-42 +0000"
"http://rt.com/news/155452-russia-ukraine-political-repressions/","RT","Moscow slams Kiev over political repressions ","Mon- 28 Apr 2014 19-24-45 +0000"
"http://rt.com/op-edge/155112-washington-policy-europe-ukraine/","RT","â€?Junta government in Kiev trigger for mine that will explode sooner or laterâ€™","Sat- 26 Apr 2014 20-02-43 +0000"
"http://rt.com/news/155092-keystone-pipeline-washington-protest/","RT"," NoKXL Thousands march in D.C. against Keystone pipeline","Sat- 26 Apr 2014 20-01-04 +0000"
"http://rt.com/business/155100-ukraine-gas-debt-eu/","RT","Ukraine s failure to pay gas debt may cut gas supply to Europe - Russiaâ€™s energy minister","Sat- 26 Apr 2014 19-23-34 +0000"
"http://rt.com/news/155080-lifenews-journalist-ukraine-photo/","RT","Ukrainian military forcing Russian reporter to kneel caught on camera","Sat- 26 Apr 2014 16-43-36 +0000"
"http://rt.com/news/155068-us-troops-lithuania-drills/","RT","US soldiers arrive in Lithuania to â€?reassureâ€™ NATO allies amid Ukrainian crisis","Sat- 26 Apr 2014 13-56-16 +0000"
"http://rt.com/news/155084-russia-planes-ukraine-airspace/","RT","Russian planes have not entered Ukrainian airspace - Moscow","Sat- 26 Apr 2014 12-49-15 +0000"
"http://rt.com/news/154508-china-pollution-environmental-law/","RT","Choking crisis China imposes stricter penalties against polluters","Thu- 24 Apr 2014 15-59-41 +0000"
"http://rt.com/news/154596-feed-your-army-ukraine/","RT","â€?Feed your army motherf ers â€™ Raging locals â€?hijackâ€™ RT report as Ukraine troops raid Slavyansk","Thu- 24 Apr 2014 15-31-17 +0000"
"http://rt.com/business/154576-sanctions-not-effective-putin/","RT","Sanctions not effective in modern world - Putin","Thu- 24 Apr 2014 14-38-33 +0000"
"http://rt.com/politics/154584-russia-vacation-state-domestic/","RT","Authorities advise state companies to send employees to Russian resorts - Putin","Thu- 24 Apr 2014 14-03-11 +0000"
"http://rt.com/news/154588-russia-drill-ukraine-operation/","RT","Russia forced to launch military drills near border in response to Ukraine op - Moscow","Thu- 24 Apr 2014 12-53-24 +0000"
"http://rt.com/news/154556-us-troops-drills-poland/","RT","US troops arrive in Poland for drills amid rising tensions over Ukraine","Thu- 24 Apr 2014 10-55-01 +0000"
"http://rt.com/news/154560-putin-junta-ukraine-attack/","RT","Putin Kiev authorities are junta if they use force against civilians","Thu- 24 Apr 2014 10-34-36 +0000"
"http://rt.com/news/154544-slavyansk-fighting-east-ukraine/","RT","Kiev military op Ukrainian army tanks APCs troops attack Slavyansk","Thu- 24 Apr 2014 09-05-28 +0000"
"http://rt.com/news/154472-gunmen-slavyansk-attack-defense/","RT","Gunmen attack self-defense forces in eastern Ukraine","Thu- 24 Apr 2014 06-36-56 +0000"
"http://rt.com/news/154452-right-sector-yarosh-unit/","RT","Ukraineâ€™s far-right leader moves HQ to the east forms new squadron","Thu- 24 Apr 2014 04-02-13 +0000"
"http://rt.com/news/154432-coal-miners-strike-ukraine/","RT","Ukraine coal miners on strike refuse to pay Kiev coup damages bill","Thu- 24 Apr 2014 01-09-33 +0000"
"http://rt.com/news/154548-pictures-russian-troops-false/","RT","US State Dept and NYT â€?photo evidenceâ€™ case collapses","Thu- 24 Apr 2014 16-34-11 +0000"
"http://rt.com/news/154580-journalist-ntv-russian-ukraine/","RT","Producer of Russian TV show vanishes in Ukraine as â€?saboteurs posing as journalistsâ€™ detained","Thu- 24 Apr 2014 16-23-44 +0000"
"http://rt.com/business/155848-russia-in-recession-imf/","RT","â€?Russia in recessionâ€™ â€“ IMF","Wed- 30 Apr 2014 10-51-39 +0000"
"http://rt.com/news/155856-ukraine-alert-president-army/","RT","Ukrainian army â€?on full alertâ€™ president admits east is beyond control","Wed- 30 Apr 2014 09-01-17 +0000"
"http://rt.com/news/155776-congo-investment-russia-economy/","RT","Congo president Africa needs Russia","Wed- 30 Apr 2014 07-16-34 +0000"
"http://rt.com/news/155748-rally-kiev-massive-fight/","RT","Far-right rally turns into massive brawl on Kievâ€™s Maidan shots heard PHOTOS ","Tue- 29 Apr 2014 22-53-56 +0000"
"http://rt.com/news/155476-shoigu-hagel-ukraine-rhetoric/","RT","Moscow calls US NATO military buildup near Russian borders â€?unprecedentedâ€™","Mon- 28 Apr 2014 21-58-10 +0000"
